DOI,Title,journal,doc_type,url,authors,Date_Received,Date_Accepted,Date_online,Acceptance_Time,Countries
https://doi.org/10.1016/j.jhin.2019.04.016,Tracking Staphylococcus aureus in the intensive care unit using whole-genome sequencing,Journal of Hospital Infection,article,http://www.sciencedirect.com/science/article/pii/S0195670119301859,S.J. Dancer and C.E. Adams and J. Smith and B. Pichon and A. Kearns and D. Morrison,2019-03-08,2019-04-22,2019-04-27,46 days 00:00:00.000000000,{'United Kingdom'}
https://doi.org/10.1016/j.jhin.2020.02.016,COVID-19 in medical personnel: observation from Thailand,Journal of Hospital Infection,article,http://www.sciencedirect.com/science/article/pii/S0195670120300906,B. Joob and V. Wiwanitkit,2020-02-15,2020-04-04,2020-04-23,50 days 00:00:00.000000000,{'Thailand'}
https://doi.org/10.1016/j.jhin.2019.06.009,Impact of a checklist used by pharmacists on hospital antimicrobial use: a patient-level interrupted time series study,Journal of Hospital Infection,article,http://www.sciencedirect.com/science/article/pii/S0195670119302671,M. Fortier and P. Pistre and V. Ferreira and M. Pinsonneault and J.M. Charbonneau and C. Proulx and A. Buisson and P. Morency-Potvin and D. Williamson and A. Ang,2019-04-19,2019-06-17,2019-06-21,60 days 00:00:00.000000000,"{'France', 'Canada'}"
https://doi.org/10.1016/j.jhin.2020.04.033,Infection prevention partners up with psychology in a Danish Hospital successfully addressing staffs fear during the COVID-19 pandemic,Journal of Hospital Infection,article,http://www.sciencedirect.com/science/article/pii/S0195670120302085,B. Olesen and H.B. Gyrup and M.W. Troelstrup and T. Marloth and M. Mølmer,,,2030-12-12,,
https://doi.org/10.1016/j.jhin.2019.02.005,Bacterial contamination rate and associated factors during bone and tendon allograft procurement from Spanish donors: exploring the contamination patterns,Journal of Hospital Infection,article,http://www.sciencedirect.com/science/article/pii/S019567011930088X,J.M. Viñuela-Prieto and A.M. Soria-García and M. González-Romero and F.J. Candel,2018-12-18,2019-02-08,2019-02-14,53 days 00:00:00.000000000,{'Spain'}
https://doi.org/10.1016/j.jhin.2019.06.008,"‘Off the rails’: hospital bed rail design, contamination, and the evaluation of their microbial ecology",Journal of Hospital Infection,article,http://www.sciencedirect.com/science/article/pii/S019567011930266X,M.A. Boyle and A. Kearney and P.C. Carling and H. Humphreys,2019-05-02,2019-06-17,2019-06-21,47 days 00:00:00.000000000,"{'United States', 'Ireland'}"
https://doi.org/10.1016/j.jhin.2020.04.025,What is going on in your hospital? Use of a non-sterile shampoo cap in neurosurgery,Journal of Hospital Infection,article,http://www.sciencedirect.com/science/article/pii/S0195670120302000,C. Lynch and K. Choudhari and R. Townsend and S. Whittaker and C. Bates,2020-04-15,2020-04-17,2020-04-24,3 days 00:00:00.000000000,{'United Kingdom'}
https://doi.org/10.1016/j.jhin.2020.04.004,Measurement of body temperature to prevent pandemic COVID-19 in hospitals in Taiwan: repeated measurement is necessary,Journal of Hospital Infection,article,http://www.sciencedirect.com/science/article/pii/S0195670120301791,S-H. Hsiao and T-C. Chen and H-C. Chien and C-J. Yang and Y-H. Chen,2020-04-03,2020-04-06,2020-04-09,4 days 00:00:00.000000000,"{'Taiwan, Province of China'}"
https://doi.org/10.1016/j.jhin.2019.05.016,Residual effect of community antimicrobial exposure on risk of hospital onset healthcare-associated Clostridioides difficile infection: a case–control study using national linked data,Journal of Hospital Infection,article,http://www.sciencedirect.com/science/article/pii/S0195670119302312,J. Pan and K. Kavanagh and C. Marwick and P. Davey and C. Wuiff and S. Bryson and C. Robertson and M. Bennie,2019-02-25,2019-05-29,2019-06-05,94 days 00:00:00.000000000,"{'France', 'United Kingdom'}"
https://doi.org/10.1016/j.jhin.2020.02.022,Effective strategies to prevent coronavirus disease-2019 (COVID-19) outbreak in hospital,Journal of Hospital Infection,article,http://www.sciencedirect.com/science/article/pii/S0195670120300980,I-K. Lee and C-C. Wang and M-C. Lin and C-T. Kung and K-C. Lan and C-T. Lee,2020-04-25,2020-05-10,2020-05-10,16 days 00:00:00.000000000,"{'unknown', 'Mexico'}"
https://doi.org/10.1016/j.jhin.2019.03.002,The economic impact of antimicrobial stewardship programmes in hospitals: a systematic literature review,Journal of Hospital Infection,article,http://www.sciencedirect.com/science/article/pii/S0195670119301069,C. Huebner and S. Flessa and N-O. Huebner,2019-01-02,2019-03-07,2019-03-14,65 days 00:00:00.000000000,{'Germany'}
https://doi.org/10.1016/j.jhin.2019.04.017,Antibiotic prophylaxis in spine surgery: a comparison of single-dose and 72-hour protocols,Journal of Hospital Infection,article,http://www.sciencedirect.com/science/article/pii/S0195670119301860,A. Maciejczak and A. Wolan-Nieroda and M. Wałaszek and M. Kołpa and Z. Wolak,2018-12-11,2019-04-24,2019-04-30,135 days 00:00:00.000000000,{'Poland'}
https://doi.org/10.1016/j.jhin.2020.04.021,"COVID-19: before stopping specific infection prevention and control measures, be sure to exclude the diagnosis",Journal of Hospital Infection,article,http://www.sciencedirect.com/science/article/pii/S0195670120301961,E. Farfour and M-C. Ballester and M. Lecuru and A. Verrat and E. Imhaus and F. Mellot and F. Karnycheff and M. Vasse and C. Cerf and P. Lesprit,2020-04-10,2020-04-14,2020-04-25,5 days 00:00:00.000000000,{'France'}
https://doi.org/10.1016/j.jhin.2020.04.038,Diversity of physicians' attitudes toward the management of infectious diseases in terminally ill patients with cancer,Journal of Hospital Infection,article,http://www.sciencedirect.com/science/article/pii/S0195670120302139,S. Morioka and M. Mori and T. Suzuki and M. Yokomichi and J. Hamano and T. Morita,2020-02-04,2020-04-23,2020-04-29,80 days 00:00:00.000000000,{'Japan'}
https://doi.org/10.1016/j.jhin.2020.03.033,Beyond the assistance: additional exposure situations to COVID-19 for healthcare workers,Journal of Hospital Infection,article,http://www.sciencedirect.com/science/article/pii/S0195670120301328,M. Belingheri and M.E. Paladino and M.A. Riva,2020-03-16,2020-03-26,2020-03-31,11 days 00:00:00.000000000,{'Italy'}
https://doi.org/10.1016/j.jhin.2019.04.021,Ultraclean air systems and the claim that laminar airflow systems fail to prevent deep infections after total joint arthroplasty,Journal of Hospital Infection,article,http://www.sciencedirect.com/science/article/pii/S0195670119301902,W. Whyte and B. Lytsy,2019-10-31,2019-12-18,2019-12-24,49 days 00:00:00.000000000,{'Sweden'}
https://doi.org/10.1016/j.jhin.2019.02.010,Potential distribution of viable norovirus after simulated vomiting,Journal of Hospital Infection,article,http://www.sciencedirect.com/science/article/pii/S0195670119300933,C. Makison Booth and G. Frost,2019-01-11,2019-02-15,2019-02-21,36 days 00:00:00.000000000,{'United Kingdom'}
https://doi.org/10.1016/j.jhin.2020.04.020,Environmental virus surveillance in the isolation ward of COVID-19,Journal of Hospital Infection,article,http://www.sciencedirect.com/science/article/pii/S019567012030195X,H. Wang and P. Mo and G. Li and P. Chen and J. Liu and H. Wang and F. Wang and Y. Zhang and Q. Zhao,2030-12-12,2030-12-12,2020-06-24,,{'China'}
https://doi.org/10.1016/j.jhin.2019.06.010,"Epidemiology and impact of norovirus outbreaks in Norwegian healthcare institutions, 2005–2018",Journal of Hospital Infection,article,http://www.sciencedirect.com/science/article/pii/S0195670119302683,L. Espenhain and T.C. Berg and H. Bentele and K. Nygård and O. Kacelnik,2018-09-11,2019-06-18,2019-06-22,281 days 00:00:00.000000000,"{'Sweden', 'Norway'}"
https://doi.org/10.1016/j.jhin.2019.03.013,Interventions to improve hand hygiene compliance in emergency departments: a systematic review,Journal of Hospital Infection,article,http://www.sciencedirect.com/science/article/pii/S0195670119301471,H-J. Seo and K-Y. Sohng and S.O. Chang and S.K. Chaung and J.S. Won and M-J. Choi,2018-10-19,2019-03-23,2019-03-30,156 days 00:00:00.000000000,{'unknown'}
https://doi.org/10.1016/j.jhin.2020.02.005,Novel coronavirus pneumonia emergency in Zhuhai: impact and challenges,Journal of Hospital Infection,article,http://www.sciencedirect.com/science/article/pii/S0195670120300517,H. Jin and J. Liu and M. Cui and L. Lu,2020-02-06,2020-02-09,2020-02-14,4 days 00:00:00.000000000,{'China'}
https://doi.org/10.1016/j.jhin.2020.05.006,Infection control challenge in setting up a temporary test centre at Hong Kong International Airport for rapid diagnosis of COVID-19 due to SARS-CoV-2,Journal of Hospital Infection,article,http://www.sciencedirect.com/science/article/pii/S0195670120302371,S-C. Wong and M. Leung and L.L-Y. Lee and K-L. Chung and V.C-C. Cheng,2020-05-04,2020-05-05,2020-05-11,2 days 00:00:00.000000000,{'Hong Kong'}
https://doi.org/10.1016/j.jhin.2019.05.007,Escherichia coli bloodstream infection outcomes and preventability: a six-month prospective observational study,Journal of Hospital Infection,article,http://www.sciencedirect.com/science/article/pii/S0195670119302208,P.J. Lillie and G. Johnson and M. Ivan and G.D. Barlow and P.J. Moss,2019-04-15,2019-05-17,2019-05-23,33 days 00:00:00.000000000,{'United Kingdom'}
https://doi.org/10.1016/j.jhin.2020.04.034,Observations on disinfectant performance,Journal of Hospital Infection,article,http://www.sciencedirect.com/science/article/pii/S0195670120302097,T. Glasbey and G. Whiteley,2019-10-29,2020-01-29,2020-05-28,93 days 00:00:00.000000000,"{'Sweden', 'United Kingdom'}"
https://doi.org/10.1016/j.jhin.2020.04.040,Putting some context to the aerosolization debate around SARS-CoV-2,Journal of Hospital Infection,article,http://www.sciencedirect.com/science/article/pii/S0195670120302255,A. Peters and P. Parneix and J. Otter and D. Pittet,2020-04-23,2020-04-24,2020-04-30,2 days 00:00:00.000000000,"{'France', 'Switzerland', 'United Kingdom'}"
https://doi.org/10.1016/j.jhin.2019.04.009,Analysis of Acinetobacter baumannii survival in liquid media and on solid matrices as well as effect of disinfectants,Journal of Hospital Infection,article,http://www.sciencedirect.com/science/article/pii/S0195670119301598,Z. Bravo and M. Orruño and T. Navascues and E. Ogayar and J. Ramos-Vivas and V.R. Kaberdin and I. Arana,2019-02-22,2019-04-07,2019-04-13,45 days 00:00:00.000000000,{'Spain'}
https://doi.org/10.1016/j.jhin.2020.02.010,The non-contact handheld cutaneous infra-red thermometer for fever screening during the COVID-19 global emergency,Journal of Hospital Infection,article,http://www.sciencedirect.com/science/article/pii/S019567012030058X,J. Aw,2020-02-11,2020-02-17,2020-02-21,7 days 00:00:00.000000000,{'Singapore'}
https://doi.org/10.1016/j.jhin.2020.03.021,Strategies for qualified triage stations and fever clinics during the outbreak of COVID-2019 in the county hospitals of Western Chongqing,Journal of Hospital Infection,article,http://www.sciencedirect.com/science/article/pii/S0195670120301201,X. Wu and H. Zhou and X. Wu and W. Huang and B. Jia,2020-03-08,2020-03-16,2020-03-20,9 days 00:00:00.000000000,{'China'}
https://doi.org/10.1016/j.jhin.2020.02.023,Understanding the emerging coronavirus: what it means for health security and infection prevention,Journal of Hospital Infection,article,http://www.sciencedirect.com/science/article/pii/S0195670120300992,A. Peters and P. Vetter and C. Guitart and N. Lotfinejad and D. Pittet,2020-05-13,2020-05-14,2020-05-21,2 days 00:00:00.000000000,{'United Kingdom'}
https://doi.org/10.1016/j.jhin.2018.09.016,Impact of test protocols and material binding on the efficacy of antimicrobial wipes,Journal of Hospital Infection,article,http://www.sciencedirect.com/science/article/pii/S0195670118305073,R. Wesgate and A. Robertson and M. Barrell and P. Teska and J-Y. Maillard,2018-07-19,2018-09-24,2018-09-28,68 days 00:00:00.000000000,"{'United States', 'United Kingdom'}"
https://doi.org/10.1016/j.jhin.2018.10.012,Whole genome sequencing of toxigenic Clostridium difficile in asymptomatic carriers: insights into possible role in transmission,Journal of Hospital Infection,article,http://www.sciencedirect.com/science/article/pii/S0195670118305474,F.D. Halstead and A. Ravi and N. Thomson and M. Nuur and K. Hughes and M. Brailey and B.A. Oppenheim,2018-07-09,2018-10-15,2018-10-22,99 days 00:00:00.000000000,{'United Kingdom'}
https://doi.org/10.1016/j.jhin.2018.11.001,"Complex design of surgical instruments as barrier for cleaning effectiveness, favouring biofilm formation",Journal of Hospital Infection,article,http://www.sciencedirect.com/science/article/pii/S0195670118305875,L.K.O. Lopes and D.M. Costa and A.F.V. Tipple and E. Watanabe and R.B. Castillo and H. Hu and A.K. Deva and K. Vickery,2018-08-17,2018-11-02,2018-11-10,78 days 00:00:00.000000000,"{'Brazil', 'Australia'}"
https://doi.org/10.1016/j.jhin.2018.12.009,Acetic acid as a decontamination method for ICU sink drains colonized by carbapenemase-producing Enterobacteriaceae and its effect on CPE infections,Journal of Hospital Infection,article,http://www.sciencedirect.com/science/article/pii/S0195670118307138,D. Smolders and B. Hendriks and P. Rogiers and M. Mul and B. Gordts,2018-10-12,2018-12-14,2018-12-21,64 days 00:00:00.000000000,{'Belgium'}
https://doi.org/10.1016/j.jhin.2018.08.010,Multistate modelling to estimate excess length of stay and risk of death associated with organ/space infection after elective colorectal surgery,Journal of Hospital Infection,article,http://www.sciencedirect.com/science/article/pii/S0195670118304420,E. Shaw and A. Gomila and M. Piriz and R. Perez and J. Cuquet and A. Vazquez and J.M. Badia and A. Lérida and D. Fraccalvieri and A. Marron and N. Freixas and A. Castro and A. Cruz and E. Limón and F. Gudiol and S. Biondo and J. Carratalà and M. Pujol and D. Camprubí and L. Martín and C. Sanz and M. Brugués and X. Serra-Aracil and L. Mora and V. Diaz-Brito and E. Moreno and F. Obradors and E. Espejo and F. Aguilar and L. Pagespetit and C. Nicolás and A. Navarro and R. Vazquez and N. Arroyo and A.F. López and S. Iftimie,2018-06-20,2018-08-10,2018-08-17,52 days 00:00:00.000000000,{'Spain'}
https://doi.org/10.1016/j.jhin.2019.10.014,Primary prevention of Clostridioides difficile infection with combination probiotics,Journal of Hospital Infection,article,http://www.sciencedirect.com/science/article/pii/S0195670119304517,T. Nagamine,2019-10-15,2019-10-15,2019-10-19,1 days 00:00:00.000000000,{'Japan'}
https://doi.org/10.1016/j.jhin.2018.11.013,Are systematic drain tip or drainage fluid cultures predictive of surgical site infections?,Journal of Hospital Infection,article,http://www.sciencedirect.com/science/article/pii/S0195670118306686,H. Macaigne and V.G. Ruggieri and  L.Vallet-Tadeusz and V. Vernet-Garnier and L.S. Aho-Glélé and O. Bajolet and A. Lefebvre,2030-12-12,2030-12-12,2030-12-12,,"{'unknown', 'China'}"
https://doi.org/10.1016/j.jhin.2018.10.014,Exposure to infected/colonized roommates and prior room occupants increases the risks of healthcare-associated infections with the same organism,Journal of Hospital Infection,article,http://www.sciencedirect.com/science/article/pii/S0195670118305516,Yi-Le Wu and Xi-Yao Yang and Xiu-Xiu Ding and Ruo-Jie Li and Meng-Shu Pan and Xue Zhao and Xiao-Qian Hu and Jing-Jing Zhang and Li-Qi Yang,2018-08-07,2018-10-15,2018-10-22,70 days 00:00:00.000000000,{'China'}
https://doi.org/10.1016/j.jhin.2019.01.025,Contribution of whole-genome sequencing to understanding of the epidemiology and control of meticillin-resistant Staphylococcus aureus,Journal of Hospital Infection,article,http://www.sciencedirect.com/science/article/pii/S0195670119300556,H. Humphreys and D.C. Coleman,2018-12-24,2019-01-29,2019-02-02,37 days 00:00:00.000000000,{'Ireland'}
https://doi.org/10.1016/j.jhin.2019.01.001,Nosocomial outbreak of extended-spectrum β-lactamase-producing Enterobacter cloacae among cardiothoracic surgical patients: causes and consequences,Journal of Hospital Infection,article,http://www.sciencedirect.com/science/article/pii/S0195670119300039,A. Noël and C. Vastrade and S. Dupont and M. de Barsy and T.D. Huang and T. Van Maerken and I. Leroux-Roels and B. Delaere and L. Melly and B. Rondelet and C. Dransart and A.S. Dincq and I. Michaux and P. Bogaerts and Y. Glupczynski,2018-10-14,2019-01-02,2019-01-07,81 days 00:00:00.000000000,{'Belgium'}
https://doi.org/10.1016/j.jhin.2018.09.003,Hand hygiene in hospitals: anatomy of a revolution,Journal of Hospital Infection,article,http://www.sciencedirect.com/science/article/pii/S0195670118304821,T. Vermeil and A. Peters and C. Kilpatrick and D. Pires and B. Allegranzi and D. Pittet,2018-09-03,2018-09-10,2018-09-17,8 days 00:00:00.000000000,"{'Switzerland', 'Portugal'}"
https://doi.org/10.1016/j.jhin.2020.01.002,A clear conscience is the sure sign of a bad memory: vancomycin-resistant enterococci and rectal thermometers,Journal of Hospital Infection,article,http://www.sciencedirect.com/science/article/pii/S0195670120300049,D.B. Oturai and L.K. Bergen and N. Frimodt-Møller,2020-01-02,2020-01-03,2020-01-09,2 days 00:00:00.000000000,{'Denmark'}
https://doi.org/10.1016/j.jhin.2020.01.021,Multiplex PCR implementation as point-of-care testing in a French emergency department,Journal of Hospital Infection,article,http://www.sciencedirect.com/science/article/pii/S0195670120300451,D. Bouzid and J-C. Lucet and X. Duval and N. Houhou-Fidouh and E. Casalino and B. Visseaux and C. Choquet and M. Renoux and V. Ing and E. Dupeyrat and A.-C. Agbessi and S.A. Postic and V. Verry and L.F. Pierrotin and L. Colosi and R. Hellman and A. Ghazali,,,2030-12-12,,
https://doi.org/10.1016/j.jhin.2018.11.012,"Antiseptic efficacies of waterless hand rub, chlorhexidine scrub, and povidone-iodine scrub in surgical settings: a meta-analysis of randomized controlled trials",Journal of Hospital Infection,article,http://www.sciencedirect.com/science/article/pii/S0195670118306674,Y-H. Ho and Y-C. Wang and E-W. Loh and K-W. Tam,2018-10-12,2018-11-21,2018-11-28,41 days 00:00:00.000000000,"{'Taiwan, Province of China'}"
https://doi.org/10.1016/j.jhin.2019.01.026,Ozonized water as an alternative to alcohol-based hand disinfection,Journal of Hospital Infection,article,http://www.sciencedirect.com/science/article/pii/S0195670119300568,H.J. Breidablik and D.E. Lysebo and L. Johannessen and Å. Skare and J.R. Andersen and O.T. Kleiven,2018-12-04,2019-01-29,2019-02-05,57 days 00:00:00.000000000,{'Norway'}
https://doi.org/10.1016/j.jhin.2018.08.019,Does simultaneous bilateral total joint arthroplasty increase deep infection risk compared to staged surgeries? A meta-analysis,Journal of Hospital Infection,article,http://www.sciencedirect.com/science/article/pii/S0195670118304535,C. Xu and P. Qu and T. Deng and K. Bell and J. Chen,2018-07-30,2018-08-29,2018-09-04,31 days 00:00:00.000000000,"{'United States', 'China'}"
https://doi.org/10.1016/j.jhin.2018.09.014,Qualitative study of the factors impacting antimicrobial stewardship programme delivery in regional and remote hospitals,Journal of Hospital Infection,article,http://www.sciencedirect.com/science/article/pii/S0195670118304936,J.L. Bishop and T.R. Schulz and D.C.M. Kong and K.L. Buising,2018-08-05,2018-09-20,2018-09-27,47 days 00:00:00.000000000,{'Australia'}
https://doi.org/10.1016/j.jhin.2020.01.014,Removal of sinks and bathing changes to control multidrug-resistant Gram-negative bacteria in a neonatal intensive care unit: a retrospective investigation,Journal of Hospital Infection,article,http://www.sciencedirect.com/science/article/pii/S0195670120300384,M. Tracy and L. Ryan and H. Samarasekara and M. Leroi and A. Polkinghorne and J. Branley,,,2030-12-12,,
https://doi.org/10.1016/j.jhin.2019.01.003,Effects of a disinfection device on colonization of sink drains and patients during a prolonged outbreak of multidrug-resistant Pseudomonas aeruginosa in an intensive care unit,Journal of Hospital Infection,article,http://www.sciencedirect.com/science/article/pii/S0195670119300052,E. de Jonge and M.G.J. de Boer and E.H.R. van Essen and H.C.M. Dogterom-Ballering and K.E. Veldkamp,,,2030-12-12,,
https://doi.org/10.1016/j.jhin.2018.12.010,Preoperative mechanical and oral antibiotic bowel preparation to reduce infectious complications of colorectal surgery – the need for updated guidelines,Journal of Hospital Infection,article,http://www.sciencedirect.com/science/article/pii/S019567011830714X,C.L.F. Battersby and N.J. Battersby and D.A.J. Slade and M. Soop and C.J. Walsh,2018-11-03,2018-12-14,2018-12-21,42 days 00:00:00.000000000,{'United Kingdom'}
https://doi.org/10.1016/j.jhin.2018.11.019,"Prospective investigation of carbapenem-resistant Klebsiella pneumonia transmission among the staff, environment and patients in five major intensive care units, Beijing",Journal of Hospital Infection,article,http://www.sciencedirect.com/science/article/pii/S0195670118306741,Zhongqiang Yan and Yu Zhou and Mingmei Du and Yanling Bai and Bowei Liu and Meiliang Gong and Hongbin Song and Yigang Tong and Yunxi Liu,2018-10-29,2018-11-29,2018-12-06,32 days 00:00:00.000000000,{'China'}
https://doi.org/10.1016/j.jhin.2018.11.003,Healthcare burden of probable and proven invasive mucormycosis: a multi-centre cost-of-illness analysis of patients treated in tertiary care hospitals between 2003 and 2016,Journal of Hospital Infection,article,http://www.sciencedirect.com/science/article/pii/S0195670118305899,S.M. Heimann and M.J.G.T. Vehreschild and O.A. Cornely and W.J. Heinz and B. Grüner and G. Silling and J. Kessel and D. Seidel and J.J. Vehreschild,2018-06-18,2018-11-05,2018-11-10,141 days 00:00:00.000000000,"{'Germany', 'Algeria'}"
https://doi.org/10.1016/j.jhin.2019.10.015,HCV and HIV epidemics among the staff of small clinics in Pakistan: a possible future scenario,Journal of Hospital Infection,article,http://www.sciencedirect.com/science/article/pii/S0195670119304530,A.A. Khan and B.A. Khan and H. Ahmed,2019-10-16,2019-10-22,2019-10-28,7 days 00:00:00.000000000,"{'Pakistan', 'China'}"
https://doi.org/10.1016/j.jhin.2018.11.018,Attributable clinical and economic burden of carbapenem-non-susceptible Gram-negative infections in patients hospitalized with complicated urinary tract infections,Journal of Hospital Infection,article,http://www.sciencedirect.com/science/article/pii/S019567011830673X,Y.P. Tabak and A.H. Sung and G. Ye and L. Vankeepuram and V. Gupta and E. McCann,2018-07-13,2018-11-23,2018-11-29,134 days 00:00:00.000000000,"{'United States', 'Andorra'}"
https://doi.org/10.1016/j.jhin.2019.02.002,Carbapenemase-producing Enterobacteriaceae digestive carriage at hospital readmission and the role of antibiotic exposure,Journal of Hospital Infection,article,http://www.sciencedirect.com/science/article/pii/S019567011930060X,S. Evain and C. Bourigault and M.-E. Juvin and S. Corvec and D. Lepelletier,2019-01-21,2019-02-06,2019-02-12,17 days 00:00:00.000000000,{'France'}
https://doi.org/10.1016/j.jhin.2018.09.002,Differences in molecular epidemiology of Staphylococcus aureus and Escherichia coli in nursing home residents and people in unassisted living situations,Journal of Hospital Infection,article,http://www.sciencedirect.com/science/article/pii/S019567011830481X,M. Olofsson and A. Matussek and R. Ehricht and P-E. Lindgren and C.J. Östgren,2018-07-06,2018-09-10,2018-09-18,67 days 00:00:00.000000000,"{'Sweden', 'Germany'}"
https://doi.org/10.1016/j.jhin.2018.10.013,Effectiveness of behavioural interventions to reduce urinary tract infections and Escherichia coli bacteraemia for older adults across all care settings: a systematic review,Journal of Hospital Infection,article,http://www.sciencedirect.com/science/article/pii/S0195670118305486,L.F. Jones and J. Meyrick and J. Bath and O. Dunham and C.A.M. McNulty,2018-06-22,2018-10-15,2018-10-22,116 days 00:00:00.000000000,{'United Kingdom'}
https://doi.org/10.1016/j.jhin.2019.01.004,Detection of hepatitis C virus in an exhumed body identified the origin of a nosocomial transmission that caused multiple fatal diseases,Journal of Hospital Infection,article,http://www.sciencedirect.com/science/article/pii/S0195670119300064,J. McDermott and S.G. Parisi and I. Martini and C. Boldrin and E. Franchin and F. Dal Bello and A. Gianelli Castiglione and E. Boeri and M. Sampaolo and M. Basso and P. Menegazzi and L. Tagliaferro and G. Palù and O.E. Varnier,,,2030-12-12,,
https://doi.org/10.1016/j.jhin.2019.11.024,Looking back on 2019 and commemorating 40 years of HIS and JHI,Journal of Hospital Infection,article,http://www.sciencedirect.com/science/article/pii/S0195670119304943,C. Lynch and N. Mahida and B. Oppenheim and J. Gray,2019-11-28,2019-11-28,2019-12-04,1 days 00:00:00.000000000,{'United Kingdom'}
https://doi.org/10.1016/j.jhin.2018.10.005,Automated detection of outbreaks of antimicrobial-resistant bacteria in Japan,Journal of Hospital Infection,article,http://www.sciencedirect.com/science/article/pii/S0195670118305401,A. Tsutsui and K. Yahara and A. Clark and K. Fujimoto and S. Kawakami and H. Chikumi and M. Iguchi and T. Yagi and M.A. Baker and T. O'Brien and J. Stelling,2018-07-30,2018-10-06,2018-10-12,69 days 00:00:00.000000000,"{'Japan', 'United States'}"
https://doi.org/10.1016/j.jhin.2018.06.004,Molecular characterization of a nosocomial outbreak of influenza B virus in an acute care hospital setting,Journal of Hospital Infection,article,http://www.sciencedirect.com/science/article/pii/S0195670118303189,M. Sansone and Å. Wiman and M.L. Karlberg and M. Brytting and L. Bohlin and L-M. Andersson and J. Westin and R. Nordén,,,2030-12-12,,
