DOI,Title,journal,doc_type,url,authors,Date_Received,Date_Accepted,Date_online,Acceptance_Time,Countries
https://doi.org/10.1016/j.jhin.2019.06.007,The healthcare environment and infection,Journal of Hospital Infection,article,http://www.sciencedirect.com/science/article/pii/S0195670119302658,J. Gray and P. Orton,2020-07-01,2020-07-01,2020-07-20,1 days 00:00:00.000000000,"{'Italy', 'Austria'}"
https://doi.org/10.1016/j.jhin.2017.09.002,Impact of electronic healthcare-associated infection surveillance software on infection prevention resources: a systematic review of the literature,Journal of Hospital Infection,article,http://www.sciencedirect.com/science/article/pii/S0195670117304917,P.L. Russo and R.Z. Shaban and D. Macbeth and A. Carter and B.G. Mitchell,2017-07-24,2017-09-01,2017-09-08,40 days 00:00:00.000000000,{'Australia'}
https://doi.org/10.1016/j.jhin.2019.05.012,Working party guidance on the control of multi-resistant acinetobacter outbreaks,Journal of Hospital Infection,article,http://www.sciencedirect.com/science/article/pii/S0195670119302257,B. Cookson,2019-05-22,2019-05-23,2019-05-29,2 days 00:00:00.000000000,{'United Kingdom'}
https://doi.org/10.1016/j.jhin.2017.10.017,Clinical factors predicting persistent carriage of Klebsiella pneumoniae carbapenemase-producing carbapenem-resistant Enterobacteriaceae among patients with known carriage,Journal of Hospital Infection,article,http://www.sciencedirect.com/science/article/pii/S0195670117305844,Y.K. Kim and S.A. Song and J.N. Lee and M. Oh and K.M. Jo and H-J. Kim and J.H. Lee and J. Park and H-J. Jang and H-K. Kim and S. Kiem,2017-08-21,2017-10-23,2017-10-27,64 days 00:00:00.000000000,"{""Korea, Democratic People's Republic of""}"
https://doi.org/10.1016/j.jhin.2017.09.023,Nudging to improve hand hygiene,Journal of Hospital Infection,article,http://www.sciencedirect.com/science/article/pii/S0195670117305327,M.G. Caris and H.A. Labuschagne and M. Dekker and M.H.H. Kramer and M.A. van Agtmael and C.M.J.E. Vandenbroucke-Grauls,2017-08-03,2017-09-24,2017-09-30,53 days 00:00:00.000000000,{'Netherlands'}
https://doi.org/10.1016/j.jhin.2017.09.010,Outbreak of Burkholderia cepacia bacteraemia in a tertiary care centre due to contaminated ultrasound probe gel,Journal of Hospital Infection,article,http://www.sciencedirect.com/science/article/pii/S0195670117305169,R. Abdelfattah and S. Al-Jumaah and A. Al-Qahtani and S. Al-Thawadi and I. Barron and S. Al-Mofada,,,2030-12-12,,
https://doi.org/10.1016/j.jhin.2017.11.014,Rapid emergence of colistin resistance and its impact on fatality among healthcare-associated infections,Journal of Hospital Infection,article,http://www.sciencedirect.com/science/article/pii/S0195670117306412,M. Aydın and Ö. Ergönül and A. Azap and H. Bilgin and G. Aydın and S.A. Çavuş and Y.Z. Demiroğlu and H.E. Alışkan and O. Memikoğlu and Ş. Menekşe and Ş. Kaya and N.A. Demir and İ. Karaoğlan and S. Başaran and Ç. Hatipoğlu and Ş. Erdinç and E. Yılmaz and A. Tümtürk and Y. Tezer and H. Demirkaya and Ş.E. Çakar and Ş. Keske and S. Tekin and C. Yardımcı and Ç. Karakoç and P. Ergen and Ö. Azap and L. Mülazımoğlu and O. Ural and F. Can and H. Akalın,2017-10-15,2017-11-26,2017-12-15,43 days 00:00:00.000000000,{'Turkey'}
https://doi.org/10.1016/j.jhin.2017.12.014,Clostridium difficile classification overestimates hospital-acquired infections,Journal of Hospital Infection,article,http://www.sciencedirect.com/science/article/pii/S0195670117306898,A. McLure and A.C.A. Clements and M. Kirk and K. Glass,2017-10-15,2017-12-11,2017-12-16,58 days 00:00:00.000000000,{'Australia'}
https://doi.org/10.1016/j.jhin.2017.11.022,Carriage of ESBL-producing Enterobacteriaceae in French hospitals: the PORTABLSE study,Journal of Hospital Infection,article,http://www.sciencedirect.com/science/article/pii/S0195670117306497,B. Pilmis and V. Cattoir and D. Lecointe and A. Limelette and I. Grall and A. Mizrahi and G. Marcade and I. Poilane and T. Guillard and N. Bourgeois Nicolaos and J-R. Zahar and A. Le Monnier,2017-10-04,2017-11-29,2017-12-06,57 days 00:00:00.000000000,{'France'}
https://doi.org/10.1016/j.jhin.2017.12.006,Molecular and epidemiological evidence of patient-to-patient hepatitis C virus transmission in a Scottish emergency department,Journal of Hospital Infection,article,http://www.sciencedirect.com/science/article/pii/S0195670117306771,I. Johannessen and J. Danial and D.B. Smith and J. Richards and L. Imrie and A. Rankin and L.J. Willocks and C. Evans and C. Leen and P. Gibson and P. Simmonds and D. Goldberg and A. McCallum and K. Roy,,,2030-12-12,,
https://doi.org/10.1016/j.jhin.2017.08.003,Role of antimicrobial stewardship programmes in children: a systematic review,Journal of Hospital Infection,article,http://www.sciencedirect.com/science/article/pii/S0195670117304474,A.R. Araujo da Silva and D.C. Albernaz de Almeida Dias and A.F. Marques and C. Biscaia di Biase and I.K. Murni and A. Dramowski and M. Sharland and J. Huebner and W. Zingg,2017-06-14,2017-08-04,2017-08-12,52 days 00:00:00.000000000,"{'Germany', 'United Kingdom', 'Indonesia', 'Brazil', 'Switzerland', 'South Africa'}"
https://doi.org/10.1016/j.jhin.2017.09.007,Staphylococcus aureus dry-surface biofilms are more resistant to heat treatment than traditional hydrated biofilms,Journal of Hospital Infection,article,http://www.sciencedirect.com/science/article/pii/S0195670117305042,A. Almatroudi and S. Tahir and H. Hu and D. Chowdhury and I.B. Gosbell and S.O. Jensen and G.S. Whiteley and A.K. Deva and T. Glasbey and K. Vickery,2017-08-16,2017-09-11,2017-09-15,27 days 00:00:00.000000000,"{'Australia', 'Saudi Arabia'}"
https://doi.org/10.1016/j.jhin.2017.09.019,Cross-sectional point prevalence survey to study the environmental contamination of nosocomial pathogens in intensive care units under real-life conditions,Journal of Hospital Infection,article,http://www.sciencedirect.com/science/article/pii/S0195670117305285,I. Wille and A. Mayr and P. Kreidl and C. Brühwasser and G. Hinterberger and A. Fritz and W. Posch and S. Fuchs and A. Obwegeser and D. Orth-Höller and C. Lass-Flörl,,,2030-12-12,,
https://doi.org/10.1016/j.jhin.2018.01.021,‘VIOLET’: a fluorescence-based simulation exercise for training healthcare workers in the use of personal protective equipment,Journal of Hospital Infection,article,http://www.sciencedirect.com/science/article/pii/S0195670118300653,B. Poller and S. Hall and C. Bailey and S. Gregory and R. Clark and P. Roberts and A. Tunbridge and V. Poran and B. Crook and C. Evans,,,2030-12-12,,
https://doi.org/10.1016/j.jhin.2019.06.012,The impact of dispatching infectious diseases physicians for infection control. Interrupted time-series analysis on carbapenem use and blood cultures,Journal of Hospital Infection,article,http://www.sciencedirect.com/science/article/pii/S0195670119302701,K. Iwata and N. Morishita and Y. Sakai and K. Doimoto and M. Nishiwaki,2019-06-09,2019-06-19,2019-06-26,11 days 00:00:00.000000000,{'Japan'}
https://doi.org/10.1016/j.jhin.2017.12.010,Traffic flow and microbial air contamination in operating rooms at a major teaching hospital in Ghana,Journal of Hospital Infection,article,http://www.sciencedirect.com/science/article/pii/S0195670117306849,M.T. Stauning and A. Bediako-Bowan and L.P. Andersen and J.A. Opintan and A.-K. Labi and J.A.L. Kurtzhals and S. Bjerrum,,,2030-12-12,,
https://doi.org/10.1016/j.jhin.2017.09.004,Failure of non-vacuum steam sterilization processes for dental handpieces,Journal of Hospital Infection,article,http://www.sciencedirect.com/science/article/pii/S0195670117304942,S. Winter and A. Smith and D. Lappin and G. McDonagh and B. Kirk,2017-08-18,2017-09-06,2017-09-10,20 days 00:00:00.000000000,{'United Kingdom'}
https://doi.org/10.1016/j.jhin.2017.08.022,Clinical factors influencing mortality risk in hospital-acquired sepsis,Journal of Hospital Infection,article,http://www.sciencedirect.com/science/article/pii/S0195670117304668,C. López-Mestanza and D. Andaluz-Ojeda and J.R. Gómez-López and J.F. Bermejo-Martín,2018-06-16,2019-03-18,2019-04-12,276 days 00:00:00.000000000,"{'United States', 'Thailand'}"
https://doi.org/10.1016/j.jhin.2017.08.009,Genomic characterization of a paediatric MRSA outbreak by next-generation sequencing,Journal of Hospital Infection,article,http://www.sciencedirect.com/science/article/pii/S019567011730453X,E. Ugolotti and E. Di Marco and R. Bandettini and R. Biassoni,2017-07-04,2017-08-09,2017-08-14,37 days 00:00:00.000000000,{'Italy'}
https://doi.org/10.1016/j.jhin.2017.11.017,Rapid monitoring of vancomycin-resistant Enterococcus faecium in hospital departments by repetitive element palindromic polymerase chain reaction,Journal of Hospital Infection,article,http://www.sciencedirect.com/science/article/pii/S0195670117306448,F. Froeschen and M. Gajdiss and J. Uebele and A. Meilaender and A. Hoerauf and M. Exner and E. Molitor and G. Bierbaum and S. Engelhart and I. Bekeredjian-Ding,2017-07-12,2017-11-27,2018-01-17,139 days 00:00:00.000000000,{'Germany'}
https://doi.org/10.1016/j.jhin.2017.10.007,Trends in device utilization ratios in intensive care units over 10-year period in South Korea: device utilization ratio as a new aspect of surveillance,Journal of Hospital Infection,article,http://www.sciencedirect.com/science/article/pii/S0195670117305479,E.J. Kim and Y.G. Kwak and S.H. Park and S.R. Kim and M.J. Shin and H.M. Yoo and S.H. Han and D.W. Kim and Y.H. Choi and J.H. Yoo and H.Y. Kim and Y.S. Kim and Y.H. Kim and T.H. Kim and H.B. Kim and K.-W. Moon and Y. Uh and B.W. Eun and M.S. Lee and S.-O. Lee and J.Y. Choi and P.G. Choe and K.-H. Hong and S.-Y. Yoo and J.-Y. Choi,2017-08-31,2017-10-10,2017-10-16,41 days 00:00:00.000000000,"{""Korea, Democratic People's Republic of""}"
https://doi.org/10.1016/j.jhin.2017.08.010,Controlling catheter-related bloodstream infections through a multi-centre educational programme for intensive care units,Journal of Hospital Infection,article,http://www.sciencedirect.com/science/article/pii/S0195670117304541,M. Musu and G. Finco and P. Mura and G. Landoni and M.F. Piazza and M. Messina and M. Tidore and M. Mucci and M. Campagna and M. Galletta,2017-04-21,2017-08-10,2017-08-16,112 days 00:00:00.000000000,{'Italy'}
https://doi.org/10.1016/j.jhin.2018.02.016,Recommendations for the successful control of a large outbreak of vancomycin-resistant Enterococcus faecium in a non-endemic hospital setting,Journal of Hospital Infection,article,http://www.sciencedirect.com/science/article/pii/S0195670118301099,F.N.J. Frakking and W.S. Bril and J.C. Sinnige and J.E. van’t Klooster and B.A.W. de Jong and E.J. van Hannen and M. Tersmette,,,2030-12-12,,
https://doi.org/10.1016/j.jhin.2018.01.002,Use of ultraviolet-fluorescence-based simulation in evaluation of personal protective equipment worn for first assessment and care of a patient with suspected high-consequence infectious disease,Journal of Hospital Infection,article,http://www.sciencedirect.com/science/article/pii/S0195670118300045,S. Hall and B. Poller and C. Bailey and S. Gregory and R. Clark and P. Roberts and A. Tunbridge and V. Poran and C. Evans and B. Crook,2017-11-20,2018-01-03,2018-01-08,45 days 00:00:00.000000000,{'United Kingdom'}
https://doi.org/10.1016/j.jhin.2018.02.004,Real-time polymerase chain reaction detection of Lichtheimia species in bandages associated with cutaneous mucormycosis in burn patients,Journal of Hospital Infection,article,http://www.sciencedirect.com/science/article/pii/S0195670118300963,E. Fréalle and S. Rocchi and M. Bacus and H. Bachelet and L. Pasquesoone and B. Tavernier and D. Mathieu and L. Millon and M. Jeanne,2017-11-13,2018-02-05,2018-02-09,85 days 00:00:00.000000000,{'France'}
https://doi.org/10.1016/j.jhin.2019.07.001,Seasonal respiratory virus testing in management of adult cystic fibrosis patients,Journal of Hospital Infection,article,http://www.sciencedirect.com/science/article/pii/S0195670119302798,S. Gohil and B. Donaghy and D. Tature and J. Kowal and S. Lea and F.Y.L. Lai and S. Range and J.W. Tang,2019-06-26,2019-07-01,2019-07-04,6 days 00:00:00.000000000,{'United Kingdom'}
https://doi.org/10.1016/j.jhin.2018.01.011,"Risk factors for hospital norovirus outbreaks: impact of vomiting, genotype, and multi-occupancy rooms",Journal of Hospital Infection,article,http://www.sciencedirect.com/science/article/pii/S0195670118300549,CJ. Fraenkel and M. Inghammar and A. Söderlund-Strand and P.J.H. Johansson and B. Böttiger,2017-12-03,2018-01-12,2018-01-31,41 days 00:00:00.000000000,{'Sweden'}
https://doi.org/10.1016/j.jhin.2017.10.019,Use of antibiotics in paediatric long-term care facilities,Journal of Hospital Infection,article,http://www.sciencedirect.com/science/article/pii/S0195670117305868,M.T. Murray and C.L. Johnson and B. Cohen and O. Jackson and L.K. Jones and L. Saiman and E.L. Larson and N. Neu,2018-10-15,2018-12-22,2019-01-30,69 days 00:00:00.000000000,"{""Korea, Democratic People's Republic of""}"
https://doi.org/10.1016/j.jhin.2017.08.005,Pattern of exposure to information and its impact on seasonal influenza vaccination uptake in nurses,Journal of Hospital Infection,article,http://www.sciencedirect.com/science/article/pii/S0195670117304498,E.K.H. Cheung and S. Lee and S.S. Lee,2017-06-24,2017-08-06,2017-08-12,44 days 00:00:00.000000000,{'Hong Kong'}
https://doi.org/10.1016/j.jhin.2017.12.017,"Predictive factors for early- and late-onset surgical site infections in patients undergoing elective colorectal surgery. A multicentre, prospective, cohort study",Journal of Hospital Infection,article,http://www.sciencedirect.com/science/article/pii/S0195670117306953,A. Gomila and J. Carratalà and S. Biondo and J.M. Badia and D. Fraccalvieri and E. Shaw and V. Diaz-Brito and L. Pagespetit and N. Freixas and M. Brugués and L. Mora and R. Perez and C. Sanz and N. Arroyo and S. Iftimie and E. Limón and F. Gudiol and M. Pujol,2017-11-13,2017-12-20,2017-12-28,38 days 00:00:00.000000000,{'Spain'}
https://doi.org/10.1016/j.jhin.2017.09.003,Molecular epidemiology and environmental contamination during an outbreak of parainfluenza virus 3 in a haematology ward,Journal of Hospital Infection,article,http://www.sciencedirect.com/science/article/pii/S0195670117304930,T. Kim and C.E. Jin and H. Sung and B. Koo and J. Park and S.-M. Kim and J.Y. Kim and Y.P. Chong and S.-O. Lee and S.-H. Choi and Y.S. Kim and J.H. Woo and J.-H. Lee and J.-H. Lee and K.-H. Lee and Y. Shin and S.-H. Kim,,,2030-12-12,,
https://doi.org/10.1016/j.jhin.2017.12.008,"Regional point prevalence study of healthcare-associated infections and antimicrobial use in acute care hospitals in Liguria, Italy",Journal of Hospital Infection,article,http://www.sciencedirect.com/science/article/pii/S0195670117306795,C. Sticchi and M. Alberti and S. Artioli and M. Assensi and I. Baldelli and A. Battistini and S. Boni and G. Cassola and Elio Castagnola and M. Cattaneo and N. Cenderello and M.L. Cristina and A.M. De Mite and P. Fabbri and F. Federa and D.R. Giacobbe and D. La Masa and C. Lorusso and K. Marioni and V.M. Masi and B. Mentore and S. Montoro and A. Orsi and D. Raiteri and R. Riente and I. Samengo and C. Viscoli and R. Carloni and C. Alicino and I. Barberis and V. Faccio and F. Grammatico and L. Magnasco and C. Paganino and C. Saffioti and G. Sarteschi and R. Ungaro and D. Bellina and V. Daturi and A.M. Di Bella and B. Guglielmi and G. Icardi and A. Morando and A. Talamini and M. Tomei and M.P. Crisalli and P. Sansone and M. Santini,2017-08-03,2017-12-08,2017-12-15,128 days 00:00:00.000000000,{'Italy'}
https://doi.org/10.1016/j.jhin.2017.09.025,Temporal trends and epidemiology of Staphylococcus aureus surgical site infection in the Swiss surveillance network: a cohort study,Journal of Hospital Infection,article,http://www.sciencedirect.com/science/article/pii/S0195670117305340,M. Abbas and E. Aghayev and N. Troillet and M.-C. Eisenring and S.P. Kuster and A.F. Widmer and S. Harbarth and Carlo Balmelli and Marie-Christine Eisenring and Stephan Harbarth and Stefan P. Kuster and Jonas Marschall and Virginie Masserey Spicher and Didier Pittet and Christian Ruef and Hugo Sax and Matthias Schlegel and Alexander Schweiger and Nicolas Troillet and Andreas F. Widmer and Giorgio Zanetti,2017-07-14,2017-09-26,2017-10-06,75 days 00:00:00.000000000,{'Switzerland'}
https://doi.org/10.1016/j.jhin.2019.07.008,Cost analysis for electron time-flow taps and point of use filters: a comparison of two methods for Legionnaires' disease prevention in hospital water networks,Journal of Hospital Infection,article,http://www.sciencedirect.com/science/article/pii/S0195670119303019,M. Totaro and E. De Vita and T. Mariotti and C. Bisordi and S. Giorgi and A. Gallo and A.L. Costa and B. Casini and P. Valentini and G. Privitera and A. Baggiani,2019-06-12,2019-07-10,2019-07-13,29 days 00:00:00.000000000,{'Italy'}
https://doi.org/10.1016/j.jhin.2018.02.008,Does saline enema during the first stage of labour reduce the incidence of Clostridium difficile colonization in neonates? A randomized controlled trial,Journal of Hospital Infection,article,http://www.sciencedirect.com/science/article/pii/S0195670118301002,A.M. Nada and R.A. Mohsen and Y.M. Hassan and A. Sabry and N.S. Soliman,2017-12-11,2018-02-07,2018-02-13,59 days 00:00:00.000000000,{'Egypt'}
https://doi.org/10.1016/j.jhin.2018.01.012,Minimizing microbial contamination risk simultaneously from multiple hospital washbasins by automated cleaning and disinfection of U-bends with electrochemically activated solutions,Journal of Hospital Infection,article,http://www.sciencedirect.com/science/article/pii/S0195670118300550,E.C. Deasy and E.M. Moloney and M.A. Boyle and J.S. Swan and D.A. Geoghegan and G.I. Brennan and T.E. Fleming and M.J. O'Donnell and D.C. Coleman,2017-12-07,2018-01-12,2018-02-02,37 days 00:00:00.000000000,"{'Ireland', 'Sao Tome and Principe'}"
https://doi.org/10.1016/j.jhin.2019.05.013,A new approach to put isolation precaution guidelines into practice,Journal of Hospital Infection,article,http://www.sciencedirect.com/science/article/pii/S0195670119302282,B. Olesen and I. Ulriksen and M. Kreiner-Moeller and D. Tomsen and A.-M. Thye,2019-05-22,2019-05-22,2019-05-29,1 days 00:00:00.000000000,{'Denmark'}
https://doi.org/10.1016/j.jhin.2017.09.012,Outbreak of Burkholderia cepacia pseudobacteraemia caused by intrinsically contaminated commercial 0.5% chlorhexidine solution in neonatal intensive care units,Journal of Hospital Infection,article,http://www.sciencedirect.com/science/article/pii/S0195670117305182,J.E. Song and Y.G. Kwak and T.H. Um and C.R. Cho and S. Kim and I.S. Park and J.H. Hwang and N. Kim and G-B. Oh,2017-06-27,2017-09-13,2017-09-19,79 days 00:00:00.000000000,"{""Korea, Democratic People's Republic of""}"
https://doi.org/10.1016/j.jhin.2018.02.003,Is cohorting the only solution to control carbapenemase-producing Enterobacteriaceae outbreaks? A single-centre experience,Journal of Hospital Infection,article,http://www.sciencedirect.com/science/article/pii/S0195670118300951,C. Legeay and V. Thépot-Seegers and H. Pailhoriès and D. Hilliquin and J.-R. Zahar,2017-12-28,2018-02-05,2018-02-10,40 days 00:00:00.000000000,{'France'}
https://doi.org/10.1016/j.jhin.2019.06.001,Evaluation of surgical site infection antibiotic prophylaxis among patients receiving antibiotics for active infection,Journal of Hospital Infection,article,http://www.sciencedirect.com/science/article/pii/S0195670119302324,C.T. Nguyen and C.M. Reuter and T. Hudson and J. Li,2019-05-29,2019-06-03,2019-06-08,6 days 00:00:00.000000000,{'United States'}
https://doi.org/10.1016/j.jhin.2019.04.018,Preventing Escherichia coli bacteraemia through improved community urinary tract infection (UTI) management: use of the TARGET Uncomplicated UTI audit tool in primary care,Journal of Hospital Infection,article,http://www.sciencedirect.com/science/article/pii/S0195670119301872,E. Wiley and C. Smith and J. Thakerar and P. Wilson,2019-04-23,2019-04-24,2019-04-28,2 days 00:00:00.000000000,{'United Kingdom'}
https://doi.org/10.1016/j.jhin.2017.03.014,Human parvovirus B19 nosocomial outbreak in healthcare personnel in a paediatric ward at a national tertiary referral centre in Thailand,Journal of Hospital Infection,article,http://www.sciencedirect.com/science/article/pii/S0195670117301457,S. Sungkate and W. Phongsamart and S. Rungmaitree and K. Lapphra and O. Wittawatmongkol and V. Pumsuwan and N. Wiruchkul and S. Assanasen and Y. Rongrungruang and N. Onlamoon and N. Horthongkham and W. Lermankul and N. Kongstan and K. Chokephaibulkit,,,2030-12-12,,
https://doi.org/10.1016/j.jhin.2017.07.017,A multi-centre prospective evaluation of the Check-Direct ESBL Screen for BD MAX as a rapid molecular screening method for extended-spectrum beta-lactamase-producing Enterobacteriaceae rectal carriage,Journal of Hospital Infection,article,http://www.sciencedirect.com/science/article/pii/S0195670117303997,T. Engel and B.J. Slotboom and N. van Maarseveen and A.A. van Zwet and M.H. Nabuurs-Franssen and F. Hagen,2017-05-12,2017-07-18,2017-07-22,68 days 00:00:00.000000000,{'Netherlands'}
https://doi.org/10.1016/j.jhin.2017.02.024,Dissemination and clinical implications of multidrug-resistant Klebsiella pneumoniae isolates producing OXA-48 in a Spanish hospital,Journal of Hospital Infection,article,http://www.sciencedirect.com/science/article/pii/S0195670117301214,A. Madueño and J. González García and S. Fernández-Romero and J. Oteo and M. Lecuona,,,2030-12-12,,
https://doi.org/10.1016/j.jhin.2017.05.002,Consecutive yearly outbreaks of respiratory syncytial virus in a haemato-oncology ward and efficacy of infection control measures,Journal of Hospital Infection,article,http://www.sciencedirect.com/science/article/pii/S0195670117302669,T. Inkster and K. Ferguson and A. Edwardson and R. Gunson and R. Soutar,,,2030-12-12,,
https://doi.org/10.1016/j.jhin.2019.02.011,Concerns regarding the validity of the conclusion in a recently published paper on Roche Liat implementation,Journal of Hospital Infection,article,http://www.sciencedirect.com/science/article/pii/S0195670119300945,J.G. Lisby and U.V. Schneider,,,2030-12-12,,
https://doi.org/10.1016/j.jhin.2017.07.005,Impact of an antimicrobial stewardship programme to optimize antimicrobial use for outpatients at an emergency department,Journal of Hospital Infection,article,http://www.sciencedirect.com/science/article/pii/S0195670117303870,A. Dinh and C. Duran and B. Davido and F. Bouchand and L. Deconinck and M. Matt and O. Sénard and C. Guyot and A.-So. Levasseur and J. Attal and D. Razazi and T. Tritz and A. Beauchet and J. Salomon and S. Beaune and J. Grenet,2017-06-16,2017-07-04,2017-07-08,19 days 00:00:00.000000000,{'France'}
https://doi.org/10.1016/j.jhin.2017.04.022,Effectiveness of environmental control measures to decrease the risk of invasive aspergillosis in acute leukaemia patients during hospital building work,Journal of Hospital Infection,article,http://www.sciencedirect.com/science/article/pii/S0195670117302384,J.F. Combariza and L.F. Toro and J.J. Orozco,2017-03-13,2017-04-25,2017-05-05,44 days 00:00:00.000000000,{'Colombia'}
https://doi.org/10.1016/j.jhin.2017.04.012,Effect of an anaesthetic screening drape on vertical laminar airflow,Journal of Hospital Infection,article,http://www.sciencedirect.com/science/article/pii/S0195670117302268,R. Sehjal and N. Bakti and R. Goddard,2017-01-09,2017-04-13,2017-04-19,95 days 00:00:00.000000000,{'United Kingdom'}
https://doi.org/10.1016/j.jhin.2019.04.002,Oxygenating the argument for consistent performance of anaerobic blood cultures and blood volumes collected,Journal of Hospital Infection,article,http://www.sciencedirect.com/science/article/pii/S0195670119301525,M. Weinbren and V. Weston and S. Woods and M. Collins and A. Coultas and N.H. O'Connell and C.P. Dunne,2018-08-31,2019-04-04,2019-04-08,217 days 00:00:00.000000000,"{'Colombia', 'Ireland', 'United Kingdom'}"
https://doi.org/10.1016/j.jhin.2017.07.008,Nationwide study on peripheral-venous-catheter-associated-bloodstream infections in internal medicine departments,Journal of Hospital Infection,article,http://www.sciencedirect.com/science/article/pii/S0195670117303900,M. Guembe and M.J. Pérez-Granda and J.A. Capdevila and J. Barberán and B. Pinilla and P. Martín-Rabadán and E. Bouza and J. Millán and C. Pérez de Oteyza and A. Muiño and M. Villalba and C. Cuenca and J.G. Castaño and C.M. Delgado and S. Zamorano and B. Gómez and J.M. Collado and M.T. Salinas and A.S. Amat and J.R. Lázaro and V. del Villar Sordo and M. del Valle Sánchez and Á.F. Benach and E. Vidal and L. Albiach and J.M. Agud Aparicio and E. Saéz de Adana Arroniz and J. Casademont i Pou and V.P. Solchaga and F.E. Castellón and T.R. Obanos and M.V. Egurbide Arberas and J.N. Arana and E.G. López and A.Z. Gaviria and I.N. Clemente and P.C. Ruíz and A.C. Salomó and S.M. Iftimie and A.M. Castillo and J.R. Barberá Farré and A.O. Lavería and M.C. Ribera and N.B. Pallarés and P.C. Suárez and F.J. Cepeda Piorno and N.A. Andrés and R.E. Rodríguez Tarazona and M.M. Rodríguez Zapata and M.A. Costa Cerdá,,,2030-12-12,,
https://doi.org/10.1016/j.jhin.2017.05.001,How do hospital respiratory clinicians perceive antimicrobial stewardship (AMS)? A qualitative study highlighting barriers to AMS in respiratory medicine,Journal of Hospital Infection,article,http://www.sciencedirect.com/science/article/pii/S0195670117302657,J. Broom and A. Broom and E. Kirby and A.F. Gibson and J.J. Post,2017-03-05,2017-05-01,2017-05-05,58 days 00:00:00.000000000,{'South Africa'}
