DOI,Title,journal,doc_type,url,authors,Date_Received,Date_Accepted,Date_online,Acceptance_Time,Countries
https://doi.org/10.1016/S2213-2600(20)30153-3,Antihypertensive drugs and risk of COVID-19?,The Lancet Respiratory Medicine,article,http://www.sciencedirect.com/science/article/pii/S2213260020301533,Christopher J Tignanelli and Nicholas E Ingraham and Matthew A Sparks and Ronald Reilkoff and Tamara Bezdicek and Bradley Benson and Timothy Schacker and Jeffrey G Chipman and Michael A Puskarich,2020-04-22,2020-06-10,2020-06-30,50 days 00:00:00.000000000,"{'United States', 'Iran, Islamic Republic of'}"
https://doi.org/10.1016/S2213-2600(20)30193-4,"Tropism, replication competence, and innate immune responses of the coronavirus SARS-CoV-2 in human respiratory tract and conjunctiva: an analysis in ex-vivo and in-vitro cultures",The Lancet Respiratory Medicine,article,http://www.sciencedirect.com/science/article/pii/S2213260020301934,Kenrie P Y Hui and Man-Chun Cheung and Ranawaka A P M Perera and Ka-Chun Ng and Christine H T Bui and John C W Ho and Mandy M T Ng and Denise I T Kuok and Kendrick C Shih and Sai-Wah Tsao and Leo L M Poon and Malik Peiris and John M Nicholls and Michael C W Chan,2020-03-10,2020-04-21,2020-05-07,43 days 00:00:00.000000000,{'Hong Kong'}
https://doi.org/10.1016/S2213-2600(20)30120-X,"COVID-19 outbreak: less stethoscope, more ultrasound",The Lancet Respiratory Medicine,article,http://www.sciencedirect.com/science/article/pii/S221326002030120X,Danilo Buonsenso and Davide Pata and Antonio Chiaretti,2020-03-07,2020-03-09,2020-03-20,3 days 00:00:00.000000000,{'Italy'}
https://doi.org/10.1016/S2213-2600(20)30230-7,Tracheostomy in the COVID-19 era: global and multidisciplinary guidance,The Lancet Respiratory Medicine,article,http://www.sciencedirect.com/science/article/pii/S2213260020302307,Brendan A McGrath and Michael J Brenner and Stephen J Warrillow and Vinciya Pandian and Asit Arora and Tanis S Cameron and José Manuel Añon and Gonzalo Hernández Martínez and Robert D Truog and Susan D Block and Grace C Y Lui and Christine McDonald and Christopher H Rassekh and Joshua Atkins and Li Qiang and Sébastien Vergez and Pavel Dulguerov and Johannes Zenk and Massimo Antonelli and Paolo Pelosi and Brian K Walsh and Erin Ward and You Shang and Stefano Gasparini and Abele Donati and Mervyn Singer and Peter J M Openshaw and Neil Tolley and Howard Markel and David J Feller-Kopman,2020-04-18,2020-05-10,2020-05-15,23 days 00:00:00.000000000,"{'United States', 'Switzerland', 'Australia', 'Italy', 'France', 'Spain', 'Hong Kong', 'Germany', 'China', 'United Kingdom'}"
https://doi.org/10.1016/S2213-2600(20)30278-2,Asthma in children during the COVID-19 pandemic: lessons from lockdown and future directions for management,The Lancet Respiratory Medicine,article,http://www.sciencedirect.com/science/article/pii/S2213260020302782,Atul Gupta and Andrew Bush and Prasad Nagakumar,2020-06-10,2020-06-18,2020-06-25,9 days 00:00:00.000000000,{'United Kingdom'}
https://doi.org/10.1016/S2213-2600(20)30226-5,Immunomodulation in COVID-19,The Lancet Respiratory Medicine,article,http://www.sciencedirect.com/science/article/pii/S2213260020302265,Nicholas E Ingraham and Sahar Lotfi-Emran and Beth K Thielen and Kristina Techar and Rachel S Morris and Shernan G Holtan and R Adams Dudley and Christopher J Tignanelli,2030-12-12,2030-12-12,2020-07-20,,"{'unknown', 'Denmark'}"
https://doi.org/10.1016/S2213-2600(20)30323-4,Particle sizes of infectious aerosols: implications for infection control,The Lancet Respiratory Medicine,article,http://www.sciencedirect.com/science/article/pii/S2213260020303234,Kevin P Fennelly,2015-05-12,2016-01-23,2016-02-25,257 days 00:00:00.000000000,"{'United Kingdom', 'South Africa'}"
https://doi.org/10.1016/S2213-2600(20)30237-X,Prevalence of putative invasive pulmonary aspergillosis in critically ill patients with COVID-19,The Lancet Respiratory Medicine,article,http://www.sciencedirect.com/science/article/pii/S221326002030237X,Alexandre Alanio and Sarah Dellière and Sofiane Fodil and Stéphane Bretagne and Bruno Mégarbane,2020-04-14,2020-05-12,2020-05-20,29 days 00:00:00.000000000,{'France'}
https://doi.org/10.1016/S2213-2600(20)30121-1,Planning and provision of ECMO services for severe ARDS during the COVID-19 pandemic and other outbreaks of emerging infectious diseases,The Lancet Respiratory Medicine,article,http://www.sciencedirect.com/science/article/pii/S2213260020301211,Kollengode Ramanathan and David Antognini and Alain Combes and Matthew Paden and Bishoy Zakhary and Mark Ogino and Graeme MacLaren and Daniel Brodie and Kiran Shekar,2020-02-14,2020-03-05,2020-03-20,21 days 00:00:00.000000000,"{'United States', 'France', 'Australia'}"
https://doi.org/10.1016/S2213-2600(20)30234-4,COVID-19 and the impact of social determinants of health,The Lancet Respiratory Medicine,article,http://www.sciencedirect.com/science/article/pii/S2213260020302344,Elissa M Abrams and Stanley J Szefler,2030-12-12,2030-12-12,2020-07-20,,{'United States'}
https://doi.org/10.1016/S2213-2600(20)30315-5,Point-of-care serological assays for delayed SARS-CoV-2 case identification among health-care workers in the UK: a prospective multicentre cohort study,The Lancet Respiratory Medicine,article,http://www.sciencedirect.com/science/article/pii/S2213260020303155,Scott J C Pallett and Michael Rayment and Aatish Patel and Sophia A M Fitzgerald-Smith and Sarah J Denny and Esmita Charani and Annabelle L Mai and Kimberly C Gilmour and James Hatcher and Christopher Scott and Paul Randell and Nabeela Mughal and Rachael Jones and Luke S P Moore and Gary W Davies,,,2030-12-12,,
