DOI,Title,journal,doc_type,url,authors,Date_Received,Date_Accepted,Date_online,Acceptance_Time,Countries
https://doi.org/10.1016/S1473-3099(20)30521-1,Association of mediastinal lymphadenopathy with COVID-19 prognosis,The Lancet Infectious Diseases,article,http://www.sciencedirect.com/science/article/pii/S1473309920305211,Francesco Sardanelli and Andrea Cozzi and Lorenzo Monfardini and Claudio Bnà and Riccardo Alessandro Foà and Angelo Spinazzola and Silvia Tresoldi and Maurizio Cariati and Francesco Secchi and Simone Schiaffino,2020-05-25,2020-06-10,2020-06-19,17 days 00:00:00.000000000,{'Italy'}
https://doi.org/10.1016/S1473-3099(20)30626-5,Communicating with children about COVID-19,The Lancet Infectious Diseases,article,http://www.sciencedirect.com/science/article/pii/S1473309920306265,Fiona Mitchell,2020-04-20,2020-05-08,2020-06-17,19 days 00:00:00.000000000,"{'United States', 'Liberia'}"
https://doi.org/10.1016/S1473-3099(20)30468-0,Acute respiratory distress syndrome during a pandemic—an obvious diagnosis?,The Lancet Infectious Diseases,article,http://www.sciencedirect.com/science/article/pii/S1473309920304680,Alexander C Reisinger and Gernot Schilcher and Juergen Prattes and Ines Zollner-Schwetz and Philipp Eller,2020-05-06,2020-05-18,2020-05-18,13 days 00:00:00.000000000,{'Austria'}
https://doi.org/10.1016/S1473-3099(20)30557-0,Biostatistics to better detect fishy findings,The Lancet Infectious Diseases,article,http://www.sciencedirect.com/science/article/pii/S1473309920305570,Arnaud Tarantola and Laurent Gautier,2020-06-04,2020-06-16,2020-06-29,13 days 00:00:00.000000000,{'France'}
https://doi.org/10.1016/S1473-3099(20)30319-4,Estimation of COVID-19 burden in Egypt,The Lancet Infectious Diseases,article,http://www.sciencedirect.com/science/article/pii/S1473309920303194,Mohamed Hassany and Wael Abdel-Razek and Noha Asem and Mohamed AbdAllah and Hala Zaid,2020-03-27,2020-04-14,2020-04-27,19 days 00:00:00.000000000,{'Egypt'}
https://doi.org/10.1016/S1473-3099(20)30234-6,Estimating case fatality rates of COVID-19,The Lancet Infectious Diseases,article,http://www.sciencedirect.com/science/article/pii/S1473309920302346,David Dongkyung Kim and Akash Goel,2030-12-12,2030-12-12,2020-07-18,,{'Ireland'}
https://doi.org/10.1016/S1473-3099(20)30496-5,Political casualties of the COVID-19 pandemic,The Lancet Infectious Diseases,article,http://www.sciencedirect.com/science/article/pii/S1473309920304965, The Lancet Infectious Diseases,2030-12-12,2030-12-12,2020-06-11,,set()
https://doi.org/10.1016/S1473-3099(20)30585-5,Harmonisation preserves research resources,The Lancet Infectious Diseases,article,http://www.sciencedirect.com/science/article/pii/S1473309920305855,Malte Kohns Vasconcelos and Cristina Epalza and Hanna Renk and Alfredo Tagarro and Julia A Bielicki,,,2030-12-12,,
https://doi.org/10.1016/S1473-3099(20)30561-2,Exaggerated risk of transmission of COVID-19 by fomites,The Lancet Infectious Diseases,article,http://www.sciencedirect.com/science/article/pii/S1473309920305612,Emanuel Goldman,2020-05-02,2020-06-12,2020-07-03,42 days 00:00:00.000000000,{'United States'}
https://doi.org/10.1016/S1473-3099(20)30258-9,Modelling COVID-19 transmission: from data to intervention,The Lancet Infectious Diseases,article,http://www.sciencedirect.com/science/article/pii/S1473309920302589,Zhongwei Jia and Zuhong Lu,2030-12-12,2020-07-07,2020-07-10,,{'United Kingdom'}
https://doi.org/10.1016/S1473-3099(20)30472-2,Hydroxychloroquine use in COVID-19: what is the basis for baseline tests?,The Lancet Infectious Diseases,article,http://www.sciencedirect.com/science/article/pii/S1473309920304722,TP Afra and Muhammed Razmi T and Anuradha Bishnoi and NA Bishurul Hafi,2020-06-19,2020-06-21,2020-07-02,3 days 00:00:00.000000000,{'United Kingdom'}
https://doi.org/10.1016/S1473-3099(20)30315-7,Projecting the demand for ventilators at the peak of the COVID-19 outbreak in the USA,The Lancet Infectious Diseases,article,http://www.sciencedirect.com/science/article/pii/S1473309920303157,Chad R Wells and Meagan C Fitzpatrick and Pratha Sah and Affan Shoukat and Abhishek Pandey and Abdulrahman M El-Sayed and Burton H Singer and Seyed M Moghadas and Alison P Galvani,2020-03-25,2020-04-08,2020-04-20,15 days 00:00:00.000000000,"{'United States', 'Canada'}"
https://doi.org/10.1016/S1473-3099(20)30367-4,Hypoxaemia related to COVID-19: vascular and perfusion abnormalities on dual-energy CT,The Lancet Infectious Diseases,article,http://www.sciencedirect.com/science/article/pii/S1473309920303674,Min Lang and Avik Som and Dexter P Mendoza and Efren J Flores and Nicholas Reid and Denston Carey and Matthew D Li and Alison Witkin and Josanna M Rodriguez-Lopez and Jo-Anne O Shepard and Brent P Little,2020-04-15,2020-04-22,2020-04-30,8 days 00:00:00.000000000,{'United States'}
https://doi.org/10.1016/S1473-3099(20)30440-0,Global outbreak research: harmony not hegemony,The Lancet Infectious Diseases,article,http://www.sciencedirect.com/science/article/pii/S1473309920304400,Tamuna Akhvlediani and Syed M Ali and Derek C Angus and Yaseen M Arabi and Sheharyar Ashraf and J Kenneth Baillie and Barnabas Bakamutumaho and Abi Beane and Fernando Bozza and Stephen J Brett and Roberto Bruzzone and Gail Carson and Lyndsey Castle and Michael Christian and J Perren Cobb and Matthew J Cummings and Eric D'Ortenzio and Menno D de Jong and Emmanuelle Denis and LPG Derde and Emily Dobell and Arjen M Dondorp and Jake W Dunning and Dean Everett and Jeremy Farrar and Rob Fowler and Dilanthi Gamage and Zhancheng Gao and Charles D Gomersall and Anthony C Gordon and Rashan Haniffa and Hayley Hardwick and Madiha Hashmi and Mohammad Hayat and Frederick G Hayden and Antonia Ho and Peter Horby and Peter W Horby and Nina Jamieson and Issrah Jawad and Marshall John and Kalynn Kennon and Saleh Khaskheli and Saye H Khoo and Trudie Lang and James Lee and Lowell Ling and John C Marshall and Mohammad I Memon and France Mentré and Laura Merson and Sarah Moore and Srinivas Murthy and Alistair Nichol and Max R O'Donnell and Piero L Olliaro and Piero Olliaro and Peter J Openshaw and Rachael Parke and Rui Pereira and Daniel Plotkin and Mark Pritchard and Ebenezer Rabindrarajan and Nagarajan Ramakrishnan and Toby Richards and Guillermo M Ruiz-Palacios and Clark D Russell and Janet T Scott and Malcolm G Semple and Nahoko Shindo and Louise Sigfrid and Emily C Somers and Arshad Taqi and Lance Turtle and Irani Thevarajan and Bharath Kumar Tirupakuzhi Vijayaraghavan and Ishara Udayanga and Sylvie van der Werf and Renaud Vatrinet and Pavan Kumar Vecham and Steve Webb and John Amuasi and Muge Cevik and William Fischer and Tom Fletcher,,,2030-12-12,,
https://doi.org/10.1016/S1473-3099(20)30459-X,A new dawn for the management of influenza?,The Lancet Infectious Diseases,article,http://www.sciencedirect.com/science/article/pii/S147330992030459X,Glenn S Tillotson,2020-04-28,2020-04-29,2020-06-08,2 days 00:00:00.000000000,{'United States'}
https://doi.org/10.1016/S1473-3099(20)30246-2,Estimating case fatality rates of COVID-19,The Lancet Infectious Diseases,article,http://www.sciencedirect.com/science/article/pii/S1473309920302462,Piotr Spychalski and Agata Błażyńska-Spychalska and Jarek Kobiela,2030-12-12,2030-12-12,2020-07-18,,{'Ireland'}
https://doi.org/10.1016/S1473-3099(20)30226-7,COVID-19 and medical education,The Lancet Infectious Diseases,article,http://www.sciencedirect.com/science/article/pii/S1473309920302267,Hanad Ahmed and Mohammed Allaf and Hussein Elghazaly,2030-12-12,2030-12-12,2020-06-10,,set()
