DOI,Title,journal,doc_type,url,authors,Date_Received,Date_Accepted,Date_online,Acceptance_Time,Countries
https://doi.org/10.1016/S1473-3099(20)30270-X,Baricitinib for COVID-19: a suitable treatment? – Authors' reply,The Lancet Infectious Diseases,article,http://www.sciencedirect.com/science/article/pii/S147330992030270X,Peter J Richardson and Mario Corbellino and Justin Stebbing,2020-03-27,2020-03-27,2020-04-03,1 days 00:00:00.000000000,"{'United Kingdom', 'Italy'}"
https://doi.org/10.1016/S1473-3099(19)30347-0,Confronting the persisting threat of the Middle East respiratory syndrome to global health security,The Lancet Infectious Diseases,article,http://www.sciencedirect.com/science/article/pii/S1473309919303470,Stanley Perlman and Esam I Azhar and Ziad A Memish and David S Hui and Alimuddin Zumla,2019-04-24,2019-06-12,2019-07-03,50 days 00:00:00.000000000,"{'United Kingdom', 'United States', 'Saudi Arabia', 'Hong Kong'}"
https://doi.org/10.1016/S1473-3099(20)30364-9,SARS-CoV-2 shedding and seroconversion among passengers quarantined after disembarking a cruise ship: a case series,The Lancet Infectious Diseases,article,http://www.sciencedirect.com/science/article/pii/S1473309920303649,Ivan Fan-Ngai Hung and Vincent Chi-Chung Cheng and Xin Li and Anthony Raymond Tam and Derek Ling-Lung Hung and Kelvin Hei-Yeung Chiu and Cyril Chik-Yan Yip and Jian-Piao Cai and Deborah Tip-Yin Ho and Shuk-Ching Wong and Sally Sau-Man Leung and Man-Yee Chu and Milky Oi-Yan Tang and Jonathan Hon-Kwan Chen and Rosana Wing-Shan Poon and Agnes Yim-Fong Fung and Ricky Ruiqi Zhang and Erica Yuen-Wing Yan and Lin-Lei Chen and Charlotte Yee-Ki Choi and Kit-Hang Leung and Tom Wai-Hin Chung and Sonia Hiu-Yin Lam and Tina Poy-Wing Lam and Jasper Fuk-Woo Chan and Kwok-Hung Chan and Tak-Chiu Wu and Pak-Leung Ho and Johnny Wai-Man Chan and Chak-Sing Lau and Kelvin Kai-Wang To and Kwok-Yung Yuen,2020-03-20,2020-04-17,2020-06-12,29 days 00:00:00.000000000,{'Hong Kong'}
https://doi.org/10.1016/S1473-3099(20)30461-8,Need for sustainable biobanking networks for COVID-19 and other diseases of epidemic potential,The Lancet Infectious Diseases,article,http://www.sciencedirect.com/science/article/pii/S1473309920304618,Rosanna W Peeling and Debrah Boeras and Annelies Wilder-Smith and Amadou Sall and John Nkengasong,,,2030-12-12,,
https://doi.org/10.1016/S1473-3099(20)30243-7,Estimates of the severity of coronavirus disease 2019: a model-based analysis,The Lancet Infectious Diseases,article,http://www.sciencedirect.com/science/article/pii/S1473309920302437,Robert Verity and Lucy C Okell and Ilaria Dorigatti and Peter Winskill and Charles Whittaker and Natsuko Imai and Gina Cuomo-Dannenburg and Hayley Thompson and Patrick G T Walker and Han Fu and Amy Dighe and Jamie T Griffin and Marc Baguelin and Sangeeta Bhatia and Adhiratha Boonyasiri and Anne Cori and Zulma Cucunubá and Rich FitzJohn and Katy Gaythorpe and Will Green and Arran Hamlet and Wes Hinsley and Daniel Laydon and Gemma Nedjati-Gilani and Steven Riley and Sabine van Elsland and Erik Volz and Haowei Wang and Yuanrong Wang and Xiaoyue Xi and Christl A Donnelly and Azra C Ghani and Neil M Ferguson,2020-03-10,2020-03-20,2020-03-30,11 days 00:00:00.000000000,{'United Kingdom'}
https://doi.org/10.1016/S1473-3099(20)30162-6,Interventions to mitigate early spread of SARS-CoV-2 in Singapore: a modelling study,The Lancet Infectious Diseases,article,http://www.sciencedirect.com/science/article/pii/S1473309920301626,Joel R Koo and Alex R Cook and Minah Park and Yinxiaohe Sun and Haoyang Sun and Jue Tao Lim and Clarence Tam and Borame L Dickens,2020-02-02,2020-02-28,2020-03-23,27 days 00:00:00.000000000,"{'United Kingdom', 'Singapore'}"
https://doi.org/10.1016/S1473-3099(20)30295-4,COVID-19 and the coming epidemic in US immigration detention centres,The Lancet Infectious Diseases,article,http://www.sciencedirect.com/science/article/pii/S1473309920302954,Jaimie P Meyer and Carlos Franco-Paredes and Parveen Parmar and Faiza Yasin and Matthew Gartland,2020-03-29,2020-04-03,2020-04-15,6 days 00:00:00.000000000,"{'Mexico', 'United States'}"
https://doi.org/10.1016/S1473-3099(20)30110-9,Initiation of a new infection control system for the COVID-19 outbreak,The Lancet Infectious Diseases,article,http://www.sciencedirect.com/science/article/pii/S1473309920301109,Xuejiao Chen and Junzhang Tian and Guanming Li and Guowei Li,2020-02-10,2020-02-12,2020-02-19,3 days 00:00:00.000000000,"{'Canada', 'China'}"
https://doi.org/10.1016/S1473-3099(20)30190-0,Scientific and ethical basis for social-distancing interventions against COVID-19,The Lancet Infectious Diseases,article,http://www.sciencedirect.com/science/article/pii/S1473309920301900,Joseph A Lewnard and Nathan C Lo,2020-03-06,2020-03-09,2020-03-23,4 days 00:00:00.000000000,{'United States'}
https://doi.org/10.1016/S1473-3099(20)30514-4,"Household studies provide key insights on the transmission of, and susceptibility to, SARS-CoV-2",The Lancet Infectious Diseases,article,http://www.sciencedirect.com/science/article/pii/S1473309920305144,Virginia E Pitzer and Ted Cohen,2020-06-03,2020-06-03,2020-06-17,1 days 00:00:00.000000000,{'United States'}
https://doi.org/10.1016/S1473-3099(20)30198-5,"Clinical and epidemiological features of 36 children with coronavirus disease 2019 (COVID-19) in Zhejiang, China: an observational cohort study",The Lancet Infectious Diseases,article,http://www.sciencedirect.com/science/article/pii/S1473309920301985,Haiyan Qiu and Junhua Wu and Liang Hong and Yunling Luo and Qifa Song and Dong Chen,2020-02-20,2020-03-10,2020-03-25,20 days 00:00:00.000000000,{'China'}
https://doi.org/10.1016/S1473-3099(20)30174-2,SARS-CoV-2 RNA more readily detected in induced sputum than in throat swabs of convalescent COVID-19 patients,The Lancet Infectious Diseases,article,http://www.sciencedirect.com/science/article/pii/S1473309920301742,Huanqin Han and Qingfeng Luo and Fan Mo and Lieming Long and Weiqiang Zheng,2020-02-27,2020-03-05,2020-03-12,8 days 00:00:00.000000000,{'China'}
https://doi.org/10.1016/S1473-3099(20)30457-6,"Effectiveness of isolation, testing, contact tracing, and physical distancing on reducing transmission of SARS-CoV-2 in different settings: a mathematical modelling study",The Lancet Infectious Diseases,article,http://www.sciencedirect.com/science/article/pii/S1473309920304576,Adam J Kucharski and Petra Klepac and Andrew J K Conlan and Stephen M Kissler and Maria L Tang and Hannah Fry and Julia R Gog and W John Edmunds and Jon C Emery and Graham Medley and James D Munday and Timothy W Russell and Quentin J Leclerc and Charlie Diamond and Simon R Procter and Amy Gimma and Fiona Yueqian Sun and Hamish P Gibbs and Alicia Rosello and Kevin van Zandvoort and Stéphane Hué and Sophie R Meakin and Arminder K Deol and Gwen Knight and Thibaut Jombart and Anna M Foss and Nikos I Bosse and Katherine E Atkins and Billy J Quilty and Rachel Lowe and Kiesha Prem and Stefan Flasche and Carl A B Pearson and Rein M G J Houben and Emily S Nightingale and Akira Endo and Damien C Tully and Yang Liu and Julian Villabona-Arenas and Kathleen O'Reilly and Sebastian Funk and Rosalind M Eggo and Mark Jit and Eleanor M Rees and Joel Hellewell and Samuel Clifford and Christopher I Jarvis and Sam Abbott and Megan Auzenbergs and Nicholas G Davies and David Simons,2020-04-23,2020-05-29,2020-06-15,37 days 00:00:00.000000000,"{'United Kingdom', 'United States'}"
https://doi.org/10.1016/S1473-3099(20)30134-1,COVID-19 pneumonia: what has CT taught us?,The Lancet Infectious Diseases,article,http://www.sciencedirect.com/science/article/pii/S1473309920301341,Elaine Y P Lee and Ming-Yen Ng and Pek-Lan Khong,2020-02-17,2020-02-17,2020-02-24,1 days 00:00:00.000000000,{'Hong Kong'}
https://doi.org/10.1016/S1473-3099(20)30428-X,COVID-19: when should quarantine be enforced?,The Lancet Infectious Diseases,article,http://www.sciencedirect.com/science/article/pii/S147330992030428X,Chris T Bauch and Madhur Anand,2030-12-12,2030-12-12,2020-07-21,,"{'Pakistan', 'Saudi Arabia'}"
https://doi.org/10.1016/S1473-3099(20)30433-3,Assessment of patients who tested positive for COVID-19 after recovery,The Lancet Infectious Diseases,article,http://www.sciencedirect.com/science/article/pii/S1473309920304333,Qi Mei and Jun Li and Ronghui Du and Xianglin Yuan and Ming Li and Jian Li,2020-04-08,2020-05-06,2020-07-06,29 days 00:00:00.000000000,"{'Germany', 'China'}"
https://doi.org/10.1016/S1473-3099(20)30158-4,Covert COVID-19 and false-positive dengue serology in Singapore,The Lancet Infectious Diseases,article,http://www.sciencedirect.com/science/article/pii/S1473309920301584,Gabriel Yan and Chun Kiat Lee and Lawrence T M Lam and Benedict Yan and Ying Xian Chua and Anita Y N Lim and Kee Fong Phang and Guan Sen Kew and Hazel Teng and Chin Hong Ngai and Li Lin and Rui Min Foo and Surinder Pada and Lee Ching Ng and Paul Anantharajah Tambyah,2020-02-23,2020-02-27,2020-03-04,5 days 00:00:00.000000000,{'Singapore'}
https://doi.org/10.1016/S1473-3099(20)30191-2,Management of pregnant women infected with COVID-19,The Lancet Infectious Diseases,article,http://www.sciencedirect.com/science/article/pii/S1473309920301912,Yongwen Luo and Kai Yin,2020-03-14,2020-05-20,2020-07-08,68 days 00:00:00.000000000,{'China'}
https://doi.org/10.1016/S1473-3099(20)30296-6,Chloroquine or hydroxychloroquine for prophylaxis of COVID-19,The Lancet Infectious Diseases,article,http://www.sciencedirect.com/science/article/pii/S1473309920302966,Nicola Principi and Susanna Esposito,2030-12-12,2030-12-12,2020-05-05,,set()
https://doi.org/10.1016/S1473-3099(20)30446-1,COVID-19 and essential pregnant worker policies,The Lancet Infectious Diseases,article,http://www.sciencedirect.com/science/article/pii/S1473309920304461,Elizabeth S McDonald,2020-05-06,2020-05-15,2020-06-02,10 days 00:00:00.000000000,{'United States'}
https://doi.org/10.1016/S1473-3099(20)30527-2,COVID-19 in health-care workers in three hospitals in the south of the Netherlands: a cross-sectional study,The Lancet Infectious Diseases,article,http://www.sciencedirect.com/science/article/pii/S1473309920305272,Reina S Sikkema and Suzan D Pas and David F Nieuwenhuijse and Áine O'Toole and Jaco Verweij and Anne van der Linden and Irina Chestakova and Claudia Schapendonk and Mark Pronk and Pascal Lexmond and Theo Bestebroer and Ronald J Overmars and Stefan van Nieuwkoop and Wouter van den Bijllaardt and Robbert G Bentvelsen and Miranda M L van Rijen and Anton G M Buiting and Anne J G van Oudheusden and Bram M Diederen and Anneke M C Bergmans and Annemiek van der Eijk and Richard Molenkamp and Andrew Rambaut and Aura Timen and Jan A J W Kluytmans and Bas B Oude Munnink and Marjolein F Q Kluytmans van den Bergh and Marion P G Koopmans,2020-04-28,2020-06-09,2020-07-02,43 days 00:00:00.000000000,"{'United Kingdom', 'Netherlands'}"
https://doi.org/10.1016/S1473-3099(20)30175-4,COVID-19 in pregnant women,The Lancet Infectious Diseases,article,http://www.sciencedirect.com/science/article/pii/S1473309920301754,Manuel B Schmid and Jehudith Fontijn and Nicole Ochsenbein-Kölble and Christoph Berger and Dirk Bassler,2030-12-12,2030-12-12,2020-07-23,,{'Portugal'}
https://doi.org/10.1016/S1473-3099(20)30434-5,Pulmonary post-mortem findings in a series of COVID-19 cases from northern Italy: a two-centre descriptive study,The Lancet Infectious Diseases,article,http://www.sciencedirect.com/science/article/pii/S1473309920304345,Luca Carsana and Aurelio Sonzogni and Ahmed Nasr and Roberta Simona Rossi and Alessandro Pellegrinelli and Pietro Zerbi and Roberto Rech and Riccardo Colombo and Spinello Antinori and Mario Corbellino and Massimo Galli and Emanuele Catena and Antonella Tosoni and Andrea Gianatti and Manuela Nebuloni,,,2030-12-12,,
https://doi.org/10.1016/S1473-3099(20)30111-0,The first Vietnamese case of COVID-19 acquired from China,The Lancet Infectious Diseases,article,http://www.sciencedirect.com/science/article/pii/S1473309920301110,Le Van Cuong and Hoang Thi Nam Giang and Le Khac Linh and Jaffer Shah and Le Van Sy and Trinh Huu Hung and Abdullah Reda and Luong Ngoc Truong and Do Xuan Tien and Nguyen Tien Huy,2020-02-07,2020-02-12,2020-02-19,6 days 00:00:00.000000000,"{'United States', 'Egypt', 'Viet Nam', 'Japan'}"
https://doi.org/10.1016/S1473-3099(20)30458-8,Monitoring approaches for health-care workers during the COVID-19 pandemic,The Lancet Infectious Diseases,article,http://www.sciencedirect.com/science/article/pii/S1473309920304588,Julia A Bielicki and Xavier Duval and Nina Gobat and Herman Goossens and Marion Koopmans and Evelina Tacconelli and Sylvie van der Werf,2020-06-07,2020-07-06,2020-07-17,30 days 00:00:00.000000000,"{'unknown', 'Spain'}"
https://doi.org/10.1016/S1473-3099(20)30313-3,Hydroxychloroquine prophylaxis for COVID-19 contacts in India,The Lancet Infectious Diseases,article,http://www.sciencedirect.com/science/article/pii/S1473309920303133,Sahaj Rathi and Pranav Ish and Ashwini Kalantri and Shriprakash Kalantri,2030-12-12,2030-12-12,2020-06-08,,"{'unknown', 'India'}"
https://doi.org/10.1016/S1473-3099(20)30232-2,Viral dynamics in mild and severe cases of COVID-19,The Lancet Infectious Diseases,article,http://www.sciencedirect.com/science/article/pii/S1473309920302322,Yang Liu and Li-Meng Yan and Lagen Wan and Tian-Xin Xiang and Aiping Le and Jia-Ming Liu and Malik Peiris and Leo L M Poon and Wei Zhang,2020-05-10,2020-06-05,2020-07-07,27 days 00:00:00.000000000,{'China'}
https://doi.org/10.1016/S1473-3099(20)30159-6,Outbreak investigation for COVID-19 in northern Vietnam,The Lancet Infectious Diseases,article,http://www.sciencedirect.com/science/article/pii/S1473309920301596,Hai Nguyen Thanh and Truong Nguyen Van and Huong Ngo Thi Thu and Binh Nghiem Van and Binh Doan Thanh and Ha Phung Thi Thu and Anh Nguyen Thi Kieu and Nhung Nguyen Viet and Guy B Marks and Greg J Fox and Thu-Anh Nguyen,2020-02-26,2020-02-28,2020-03-04,3 days 00:00:00.000000000,"{'Viet Nam', 'Australia'}"
https://doi.org/10.1016/S1473-3099(20)30192-4,COVID-19 in pregnant women – Authors' reply,The Lancet Infectious Diseases,article,http://www.sciencedirect.com/science/article/pii/S1473309920301924,David Baud and Eric Giannoni and Léo Pomar and Xiaolong Qi and Karin Nielsen-Saines and Didier Musso and Guillaume Favre,2020-03-09,2020-03-10,2020-03-17,2 days 00:00:00.000000000,"{'United States', 'Switzerland', 'France', 'China'}"
https://doi.org/10.1016/S1473-3099(20)30297-8,Utility of hyposmia and hypogeusia for the diagnosis of COVID-19,The Lancet Infectious Diseases,article,http://www.sciencedirect.com/science/article/pii/S1473309920302978,François Bénézit and Paul Le Turnier and Charles Declerck and Cécile Paillé and Matthieu Revest and Vincent Dubée and Pierre Tattevin and Cédric Arvieux and Marion Baldeyrou and Jean-Marc Chapplain and Pauline Comacle and Solène Patrat-Delon and Anne Maillard and Mélanie Poinot and Charlotte Pronier and Faouzi Souala and Vincent Thibault and Pierre Abgueguen and Hélène Cormier and Valérie Delbos and Marine de la Chapelle and Alexandra Ducancelle and Rafael Mahieu and Valérie Rabier and Sami Rehaiem and Yves Vandamme and Charlotte Biron and Jeanne Brochon and David Boutoille and Marie Chauveau and Colin Deschanvres and Benjamin J Gaborit and Joël Jenvrin and Raphaël Lecomte and Maeva Lefebvre and François Raffi,,,2030-12-12,,
https://doi.org/10.1016/S1473-3099(20)30176-6,"Clinical features and obstetric and neonatal outcomes of pregnant patients with COVID-19 in Wuhan, China: a retrospective, single-centre, descriptive study",The Lancet Infectious Diseases,article,http://www.sciencedirect.com/science/article/pii/S1473309920301766,Nan Yu and Wei Li and Qingling Kang and Zhi Xiong and Shaoshuai Wang and Xingguang Lin and Yanyan Liu and Juan Xiao and Haiyi Liu and Dongrui Deng and Suhua Chen and Wanjiang Zeng and Ling Feng and Jianli Wu,2020-02-19,2020-03-04,2020-03-24,15 days 00:00:00.000000000,{'China'}
https://doi.org/10.1016/S1473-3099(20)30273-5,Connecting clusters of COVID-19: an epidemiological and serological investigation,The Lancet Infectious Diseases,article,http://www.sciencedirect.com/science/article/pii/S1473309920302735,Sarah Ee Fang Yong and Danielle Elizabeth Anderson and Wycliffe E Wei and Junxiong Pang and Wan Ni Chia and Chee Wah Tan and Yee Leong Teoh and Priyanka Rajendram and Matthias Paul Han Sim Toh and Cuiqin Poh and Valerie T J Koh and Joshua Lum and Nur-Afidah Md Suhaimi and Po Ying Chia and Mark I-Cheng Chen and Shawn Vasoo and Benjamin Ong and Yee Sin Leo and Linfa Wang and Vernon J M Lee,2020-03-05,2020-03-27,2020-04-21,23 days 00:00:00.000000000,{'Singapore'}
https://doi.org/10.1016/S1473-3099(20)30180-8,"COVID-19, a pandemic or not?",The Lancet Infectious Diseases,article,http://www.sciencedirect.com/science/article/pii/S1473309920301808, The Lancet Infectious Diseases,2020-05-18,2020-06-07,2020-07-23,21 days 00:00:00.000000000,{'United States'}
https://doi.org/10.1016/S1473-3099(20)30229-2,"Using observational data to quantify bias of traveller-derived COVID-19 prevalence estimates in Wuhan, China",The Lancet Infectious Diseases,article,http://www.sciencedirect.com/science/article/pii/S1473309920302292,Rene Niehus and Pablo M De Salazar and Aimee R Taylor and Marc Lipsitch,2020-02-18,2020-03-13,2020-04-01,25 days 00:00:00.000000000,{'United States'}
https://doi.org/10.1016/S1473-3099(20)30257-7,Likelihood of survival of coronavirus disease 2019,The Lancet Infectious Diseases,article,http://www.sciencedirect.com/science/article/pii/S1473309920302577,Shigui Ruan,2030-12-12,2030-12-12,2020-07-23,,{'unknown'}
https://doi.org/10.1016/S1473-3099(20)30285-1,A Spanish-translated clinical algorithm for management of suspected SARS-CoV-2 infection in pregnant women,The Lancet Infectious Diseases,article,http://www.sciencedirect.com/science/article/pii/S1473309920302851,Raigam J Martinez-Portilla and Anna Goncé and Ameth Hawkins-Villarreal and Francesc Figueras,2020-03-23,2020-04-02,2020-04-09,11 days 00:00:00.000000000,{'Spain'}
https://doi.org/10.1016/S1473-3099(20)30584-3,"Serology-informed estimates of SARS-CoV-2 infection fatality risk in Geneva, Switzerland",The Lancet Infectious Diseases,article,http://www.sciencedirect.com/science/article/pii/S1473309920305843,Javier Perez-Saez and Stephen A Lauer and Laurent Kaiser and Simon Regard and Elisabeth Delaporte and Idris Guessous and Silvia Stringhini and Andrew S Azman and Davidovic Alioucha and Isabelle Arm-Vernez and Sultan Bahta and Jonathan Barbolini and Hélène Baysson and Rebecca Butzberger and Sophie Cattani and François Chappuis and Alison Chiovini and Prune Collombet and Delphine Courvoisier and David De Ridder and Eugénie De Weck and Paola D'ippolito and Antoine Daeniker and Odile Desvachez and Yaron Dibner and Céline Dubas and Joséphine Duc and Isabella Eckerle and Céline Eelbode and Nacira El Merjani and Benjamin Emery and Benoit Favre and Antoine Flahault and Natalie Francioli and Laurent Gétaz and Alice Gilson and Acem Gonul and Julie Guérin and Lina Hassar and Aurélia Hepner and Francesca Hovagemyan and Samia Hurst and Olivia Keiser and Melis Kir and Gaëlle Lamour and Pierre Lescuyer and Fanny Lombard and Amélie Mach and Yasmina Malim and Eva Marchetti and Kailing Marcus and Soraya Maret and Chantal Martinez and Kourosh Massiha and Virginie Mathey-Doret and Loan Mattera and Philippe Matute and Jean-Michel Maugey and Benjamin Meyer and Tom Membrez and Natacha Michel and Aleksandra Mitrovic and Emmanuelle Marie Mohbat and Mayssam Nehme and Natacha Noël and Hugo-Ken Oulevey and Febronio Pardo and Francesco Pennacchio and Dusan Petrovic and Attilio Picazio and Giovanni Piumatti and Didier Pittet and Jane Portier and Géraldine Poulain and Klara Posfay-Barbe and Jean-François Pradeau and Caroline Pugin and Rakotomiaramanana Barinjaka Rakotomiaramanana and Aude Richard and Christiane Rocchia Fine and Irine Sakvarelidze and Lilas Salzmann-Bellard and Magdalena Schellongova and Stephanie Schrempft and Mélanie Seixas Miranda and Milena Stimec and Michel Tacchino and Sophie Theurillat and Mélissa Tomasini and Kor-Gael Toruslu and Nawel Tounsi and Didier Trono and Natacha Vincent and Guillemette Violot and Nicolas Vuilleumier and Zoé Waldmann and Sylvie Welker and Manon Will and Ania Wisniak and Sabine Yerly and Maria-Eugenia Zaballa and Alenka Zeballos Valle,2020-06-08,2020-06-24,2020-07-14,17 days 00:00:00.000000000,"{'United States', 'Switzerland'}"
https://doi.org/10.1016/S1473-3099(20)30147-X,"A family cluster of SARS-CoV-2 infection involving 11 patients in Nanjing, China",The Lancet Infectious Diseases,article,http://www.sciencedirect.com/science/article/pii/S147330992030147X,Rui Huang and Juan Xia and Yuxin Chen and Chun Shan and Chao Wu,2020-02-19,2020-02-21,2020-02-28,3 days 00:00:00.000000000,{'China'}
https://doi.org/10.1016/S1473-3099(20)30463-1,Challenges and issues of SARS-CoV-2 pool testing,The Lancet Infectious Diseases,article,http://www.sciencedirect.com/science/article/pii/S1473309920304631,Baijayantimala Mishra and Bijayini Behera and Monalisa Mohanty and Akshatha Ravindra and Jai Ranjan,2020-05-09,2020-05-19,2020-07-14,11 days 00:00:00.000000000,"{'United Kingdom', 'Switzerland', 'Germany'}"
https://doi.org/10.1016/S1473-3099(20)30560-0,Asymptomatic SARS-CoV-2 infection in Belgian long-term care facilities,The Lancet Infectious Diseases,article,http://www.sciencedirect.com/science/article/pii/S1473309920305600,Ana Hoxha and Chloe Wyndham-Thomas and Sofieke Klamer and Dominique Dubourg and Melissa Vermeulen and Naima Hammami and Laura Cornelissen,2020-05-25,2020-06-16,2020-07-03,23 days 00:00:00.000000000,{'Belgium'}
https://doi.org/10.1016/S1473-3099(20)30435-7,Implication of SARS-CoV-2 evolution in the sensitivity of RT-qPCR diagnostic assays,The Lancet Infectious Diseases,article,http://www.sciencedirect.com/science/article/pii/S1473309920304357,Nuno Sampaio Osório and Margarida Correia-Neves,2020-04-10,2020-05-12,2020-05-28,33 days 00:00:00.000000000,{'Portugal'}
https://doi.org/10.1016/S1473-3099(20)30314-5,Investigation of a COVID-19 outbreak in Germany resulting from a single travel-associated primary case: a case series,The Lancet Infectious Diseases,article,http://www.sciencedirect.com/science/article/pii/S1473309920303145,Merle M Böhmer and Udo Buchholz and Victor M Corman and Martin Hoch and Katharina Katz and Durdica V Marosevic and Stefanie Böhm and Tom Woudenberg and Nikolaus Ackermann and Regina Konrad and Ute Eberle and Bianca Treis and Alexandra Dangel and Katja Bengs and Volker Fingerle and Anja Berger and Stefan Hörmansdorfer and Siegfried Ippisch and Bernd Wicklein and Andreas Grahl and Kirsten Pörtner and Nadine Muller and Nadine Zeitlmann and T Sonia Boender and Wei Cai and Andreas Reich and Maria an der Heiden and Ute Rexroth and Osamah Hamouda and Julia Schneider and Talitha Veith and Barbara Mühlemann and Roman Wölfel and Markus Antwerpen and Mathias Walter and Ulrike Protzer and Bernhard Liebl and Walter Haas and Andreas Sing and Christian Drosten and Andreas Zapf,2020-03-12,2020-04-09,2020-05-15,29 days 00:00:00.000000000,"{'Sweden', 'Germany'}"
https://doi.org/10.1016/S1473-3099(20)30516-8,Challenges and issues of SARS-CoV-2 pool testing,The Lancet Infectious Diseases,article,http://www.sciencedirect.com/science/article/pii/S1473309920305168,Jaehyeon Lee and So Yeon Kim and Heungsup Sung and Sang Won Lee and Hyukmin Lee and Kyoung Ho Roh and Cheon Kwon Yoo and Ki Ho Hong,2020-05-09,2020-05-19,2020-07-14,11 days 00:00:00.000000000,"{'United Kingdom', 'Switzerland', 'Germany'}"
https://doi.org/10.1016/S1473-3099(20)30141-9,Convalescent plasma as a potential therapy for COVID-19,The Lancet Infectious Diseases,article,http://www.sciencedirect.com/science/article/pii/S1473309920301419,Long Chen and Jing Xiong and Lei Bao and Yuan Shi,2030-12-12,2030-12-12,2020-07-21,,"{'United States', 'Lebanon'}"
https://doi.org/10.1016/S1473-3099(20)30395-9,Who is most likely to be infected with SARS-CoV-2?,The Lancet Infectious Diseases,article,http://www.sciencedirect.com/science/article/pii/S1473309920303959,Rachel E Jordan and Peymane Adab,2020-05-01,2020-07-01,2020-07-23,62 days 00:00:00.000000000,"{'United States', 'China'}"
https://doi.org/10.1016/S1473-3099(20)30250-4,SARS-CoV-2: a time for clear and immediate action,The Lancet Infectious Diseases,article,http://www.sciencedirect.com/science/article/pii/S1473309920302504,Gregory A Poland,2020-03-18,2020-03-19,2020-03-31,2 days 00:00:00.000000000,{'United States'}
https://doi.org/10.1016/S1473-3099(20)30371-6,Risk factors for SARS-CoV-2 among patients in the Oxford Royal College of General Practitioners Research and Surveillance Centre primary care network: a cross-sectional study,The Lancet Infectious Diseases,article,http://www.sciencedirect.com/science/article/pii/S1473309920303716,Simon de Lusignan and Jienchi Dorward and Ana Correa and Nicholas Jones and Oluwafunmi Akinyemi and Gayatri Amirthalingam and Nick Andrews and Rachel Byford and Gavin Dabrera and Alex Elliot and Joanna Ellis and Filipa Ferreira and Jamie Lopez Bernal and Cecilia Okusi and Mary Ramsay and Julian Sherlock and Gillian Smith and John Williams and Gary Howsam and Maria Zambon and Mark Joy and F D Richard Hobbs,2020-04-15,2020-04-29,2020-05-15,15 days 00:00:00.000000000,"{'South Africa', 'United Kingdom'}"
https://doi.org/10.1016/S1473-3099(20)30518-1,Negative SARS-CoV-2 PCR in patients with chilblain-like lesions,The Lancet Infectious Diseases,article,http://www.sciencedirect.com/science/article/pii/S1473309920305181,Thomas Hubiche and Florence Le Duff and Christine Chiaverini and Valérie Giordanengo and Thierry Passeron,2020-05-20,2020-06-10,2020-06-18,22 days 00:00:00.000000000,{'France'}
